title,author,publisher,year,pages,tags,description
아홉수 가위(아홉수 가위),범유진,안전가옥,2021,,"문학, 200~300쪽, 만화","스물아홉 주인공은 모든 게 네 탓이라고 말하는 호구 같은 현실을 참아내며 살다가, 어느날 죽기로 결심하고 돌아가신 할머니의 외진 시골집으로 간다. 거기서 귀신을 만나는데 내 집에서 나가라고 하는 귀신과 동거를 하게 되며 희한하게 살아갈 힘이 생긴다. 귀신과 동거하는 장면이 조금 코믹하다."
"악의와 악의 (열다섯, 그럴 나이)",나윤아,우리학교,2020,,"문학, 200~300쪽, 소설","청소년 몸캠피싱 소재를 다뤘다. 개인 영상 혹은 합성 사진 등을 가지고, 돈을 안 주면 퍼뜨리겠다고 협박하는 범죄자의 지독한 악의, SNS로 빠르게 퍼지는 사진이나 영상에 대해 별 생각 없이 퍼뜨리고 조롱하는 사람들의 흔한 악의. 일상을 파괴당한 주인공이 어떻게 다시 일상을 회복하는지 손에 땀을 쥐고 따라가다보면 소설의 끝 이후를 응원하게 된다."
안간힘,유병록,창비,2019,212,"문학, 200~300쪽, 시",어느 날 어린 아들을 잃은 저자가 아들을 잃고 난 후의 삶에 대해 써 내려간 에세이이다. 아들을 잃기 전에는 무관심했던 사람들을 다시 보게 되게 된 이야기와 슬픔을 떨치기 위해 안간힘을 썼던 날들을 기록하고 있다.
안녕 커뮤니티 1-2,다드래기,창비,2020,608,"기타, 300쪽 이상, 만화","두께를 보고 한 번, 너무 재밌어서 두 번 놀라는 책. 문안동에서 사진관 박씨의 고독사 후에 동네 노인들이 서로의 생사를 확인하는 모임이 만들어진다. 가부장제, 다문화가정, 성소수자, 젠트리피케이션 같은 다양한 사회 문제를 정확하고 짚고 유쾌하게 표현한다."
"안녕, 내 첫사랑",이금이,밤티,2021,240,"문학, 200~300쪽, 소설","2009년 출간되어 꾸준한 사랑을 받았던 <첫사랑>의 개정판, 아빠의 재혼으로 인생 최악의 시기를 보내던 동재에게 연아가 한 눈에 들어온다. 강렬한 첫사랑의 기억을 불러일으키는, 세상 모든 사랑을 응원하는 이금이 작가의 달콤쌉쌀한 연애담."
"안녕, 내 첫사랑",이금이,밤티,2021,240,"문학, 200~300쪽, 소설","2009년 출간되어 꾸준한 사랑을 받았던 <첫사랑>의 개정판, 아빠의 재혼으로 인생 최악의 시기를 보내던 동재에게 연아가 한 눈에 들어온다. 강렬한 첫사랑의 기억을 불러일으키는, 세상 모든 사랑을 응원하는 이금이 작가의 달콤쌉쌀한 연애담."
"안녕, 베트남",심진규,양철북,2018,204,"인문사회, 200~300쪽, 교양","갑자기 할아버지는 해외여행을 보내달라고 단식투쟁을 하시고, 할아버지를 따라 베트남 여행길에 나선 도현이는 신비로운 소년 티엔을 만나면서부터 혼란과 함께 의문의 실마리가 풀리는데. 아이들에게 들려주는 베트남 전쟁과 한국군 이야기."
"안녕, 인간",해나 프라이,와이즈베리,2019,352,"과학, 300쪽 이상, 시",인공지능과 알고리즘이 무엇인지 알게해 준다. 알고리즘에 맡겨 놓았을 때 생길 수 있는 다양한 상황과 편견을 보여주어 반드시 깨어있는 사람과 인공지능이 함께 가야한다는 걸 보여준다.
안녕이 오고 있어,하양지,문학동네,2022,284,"기타, 200~300쪽, 만화",슬픈 내용이 아닌데 읽다가 눈물이 날 수 있다. 이런 친구들이 있었을 것 같은 학창시절이 떠오른다. 열다섯 살 네 명의 여자 친구들 중 한 명의 전학으로 인해 서로의 관계를 다시 짚어보는 과정이 잘 나타난다.
"안녕하십니까, 학교입니다",권재원,서유재,2017,220,"인문사회, 200~300쪽, 에세이",교사가 학부모에게 교육이 어떠해야 하는지를 설명한 책. 부모인 교사가 읽으면 뜨끔해지기도 한다.
"안녕하십니까, 학교입니다",권재원,서유재,2017,220,"인문사회, 200~300쪽, 에세이",교사가 학부모에게 교육이 어떠해야 하는지를 설명하는데 부모인 교사가 읽으면 뜨끔해지기도한다.
안중근 재판정 참관기,김흥식,서해문집,2015,192,"인문사회, 200쪽 이하, 교양",이토 히로부미에게 총을 겨눈 안중근 의사는 현장에서 바로 체포되어 뤼순감옥에 수감되었고 뤼순관동법원 재판정에서 6번의 공판을 받는다. 안중근 의사 재판정 참관기가 생생하게 펼쳐진다.
안중근안쏠로지,"안중근
 의사기념관",서울셀렉션,2019,276,"인문사회, 200~300쪽, 소설","영화 영웅, 소설 하얼빈 등으로 접한 안중근 의사의 실제 기록을 찾아볼 수 있는 책. 안응칠 역사, 동양평화론 등이 함께 실려있다. 안중근의사기념관에서 낸 책답게 사진 자료가 많고, 어렸을 때 본 위인전이 떠오르는 문체이다. 역사 책을 좋아하는 학생들에게 이런 자료도 있다고 알려줄 만할 듯하다."
"알고 싶니 마음, 심리툰",팔호광장,넥서스,2020,328,"기타, 300쪽 이상, 만화",정신과 전문의가 그린 정신과 심리만화. 정신의학과 심리학을 만화로 그려서 알기 쉽게 표현하고 있다. 우리가 일상에서 겪는 심리적인 문제의 본질을 설명해 주어 읽으면서 자신에 대해 생각해보기 좋다. 그림이 귀엽고 재치가 있어 재미있다.
알래스카 한의원,이소영,사계절,2023,304,"문학, 300쪽 이상, 소설","살고자 하는 욕망보다 더한 것이 있을까. 나를 치유하려면 나를 직면하고, 주변과 관계를 맺고, 세상과 소통해야 한다는 이야기를 재미있고 아름다운 소설로 만날 수 있다. 함께 읽고 이야기 나누면 각자의 경험과 철학이 풍부하게 공유될 듯."
알렉산더와 장난감 쥐,레오 리오니,시공주니어,2019,44,"과학, 200쪽 이하, 교양",정말 멋진 책이다. 사람에게 미움받는 쥐가 사랑받는 장난감 쥐를 부러워해서 장난감 쥐가 되게 해달라고 빌려다가 결국 버림 받은 장난감 쥐에게 생명을 달라는 빌고 둘은 함께 행복한 삶을 살게 된다.
"알로하, 나의 엄마들",이금이,창비,2020,400,"인문사회, 300쪽 이상, 소설","사진 신부'가 된 세 여인의 삶. 100여 년 전 우리의 아픈 역사 속에서 연대와 포용과 사랑으로 그 아픔을 이겨나가는 여인들, 우리 엄마들의 이야기. 오래 전 이야기지만 또 지금의 우리 사회-결혼 이주민들을 쉽게 만날 수 있는-와 다르지 않은 삶 속에서 어떻게 하면 편견과 오해 없이 살아갈 수 있을 것인지를 생각해보게 하는 책이다. 손수건 필수^^"
알바생 자르기 (산 자들),장강명,아시아,2019,,"문학, 200~300쪽, 소설","정규직, 비정규직 양쪽을 모두 비판하여 답답하면서도 불편한 소설. 서술자의 태도 방식 변화, 그리고 그를 통한 작가의 의도 등 소설 기법으로도 접근하기 좋은 소설이다. 비정규직 문제를 다룰 때에 '분노의 숫자'라는 책의 통계 내용과 같이 수업하면 좀 더 입체적인 이야기가 가능하다."
알바생 자르기 (산 자들),장강명,아시아,2019,,"문학, 200~300쪽, 소설","정규직, 비정규직 양쪽을 모두 비판하여 답답하면서도 불편한 소설. 서술자의 태도 방식 변화, 그를 통한 작가의 의도 등 소설 기법으로도 접근하기 좋은 소설이다. 비정규직 문제를 다룰 때에 '분노의 숫자'라는 책의 통계 내용과 같이 수업하면 좀 더 입체적인 이야기가 가능하다."
알바생 자르기 (산 자들),장강명,아시아,2019,128,"문학, 200쪽 이하, 소설","정규직, 비정규직 양쪽을 모두 비판하여 답답하면서도 불편한 소설. 서술자의 태도 방식 변화, 그리고 그를 통한 작가의 의도 등 소설 기법으로도 접근하기 좋은 소설이다. 비정규직 문제를 다룰 때에 '분노의 숫자'라는 책의 통계 내용과 같이 수업하면 좀 더 입체적인 이야기가 가능하다."
알바트로스의 꿈,신유미,달그림,2021,52,"기타, 200쪽 이하, 교양",기어코 하늘을 나는 꿈을 이뤄내는 알바트로스를 만나 함께 행복해지는 책. 수묵화 같은 삽화가 멋지다.
알사탕,백희나,책읽는곰,2017,48,"기타, 200쪽 이하, 교양","혼자 노는 동동이가 문방구에서 산 알사탕을 먹을 때마다 알사탕 모양과 비슷한 사물 혹은 사람의 속마음이 들린다. 소파, 강아지, 아빠, 돌아가신 할머니. 동동이가 친구를 찾으면서 외로움을 극복한다."
알지 못하는 아이의 죽음,은유,돌베개,2019,252,"기타, 200~300쪽, 교양","현장실습생으로 일하다 자살한 학생이 남긴 기록과 관련 사람들의 인터뷰, 읽다보면 특성화고 현장실습의 문제 뿐 아니라 열악한 비정규 노동 현실, 노동교육의 부재, 고졸자에 대한 차별적 시선 등 우리 사회의 보편적인 노동, 인권 문제를 생각하게 된다."
알지 못하는 아이의 죽음,은유,돌베개,2019,252,"기타, 200~300쪽, 교양","현장실습생으로 일하다 자살한 학생이 남긴 기록과 관련 사람들의 인터뷰, 읽다보면 특성화고 현장실습의 문제 뿐 아니라 열악한 비정규 노동 현실, 노동교육의 부재, 고졸자에 대한 차별적 시선 등 우리 사회의 보편적인 노동, 인권 문제를 생각하게 된다."
앞으로 올 사랑,정혜윤,위고,2020,296,"인문사회, 200~300쪽, 교양",그들은 다가올 세상에 책임감을 가졌다`. 코로나를 겪으면서 앞으로의 삶은 이전과 달라질 수밖에 없을 거라고들 한다.정혜윤의 시선은 예리하지만 유머를 잃지 않고 있고 방향에 대해 얘기한다. 멈칫거리면서 읽다보면 성찰과 작은 결심을 하게 된다.
앵거게임,조시온,씨드북,2020,56,"기타, 200쪽 이하, 교양",화를 내면 상대방에게 상처를 주고 자신은 에너지가 줄어드는 앵거게임을 시작한다. 화는 자신의 욕구를 들여다보게 하는 신호이다. 화의 폭발적인 힘을 자신의 소중한 것을 지키는 방향으로 사용한다면 삶이 더 행복하고 평화로울 것이다. 재미있다.
앵그리맨,그로 달레,내인생의책,2014,48,"기타, 200쪽 이하, 교양","가정폭력을 하는 아빠 안에 앵그리맨이 있어 그렇다고 생각하는 소년이 아빠가 가족을 때린다는 편지를 임금님에게 써서 아빠는 치료를 받을 수 있게 된다. 아빠 속에 많은 앵그리맨이 있어 그렇다고. 아빠도 이해하고, 아이의 용기도 멋지게 그린 책이다."
야밤의 공대생 만화,맹기완,뿌리와이파리,2017,392,"과학, 300쪽 이상, 만화","재미있게 볼 수 있는 만화책. 평소 교과서 속에서 누구나 이름은 들어봤을 과학자들, 재미없고 딱딱하게만 느껴지는 과학자들이 에피소드들이 꽤나 흥미롭다."
야채호빵의 봄방학(1~4),박수봉,영컴,2022,1247,"기타, 300쪽 이상, 만화",요리를 좋아하고 늘 먹는 고민만 하는 '야채'. 새 학기 야채에게 찾아온 봄방학 같은 설렘 그리고 야채와 얽힌 여러 인물들의 숨겨진 이야기가 나온다.
양과 강철의 숲,미야시타 나츠,위즈덤하우스,2016,280,"문학, 200~300쪽, 소설","스스로 특별한 재능이 없다고 여기는 '도무라'는 늘 겸손한 자세로 무언가를 배우고, 마지막에는 '도무라 같은 사람이 도달할 수 있는 경지'라는 칭찬을 듣는다. 재능이 있어야만 꿈을 이루는 것이 아니라는 사실을, 묵묵히 앞으로 나아가는 것 또한 재능임을 알려준다. 무엇을 해야 할지 몰라 망설이는 아이들, 재능이 없다고 고민하는 아이들, 꿈이 없어 불안한 아이들과 함께 읽기 좋다."
양말들(부루마블에 평양이 있다면),윤고은,문학동네,2019,,"문학, 200~300쪽, 소설","젊은 나이에 갑작스레 죽은 주인공의 영혼이, 죽은 육체 곁에 잠시 머물며 자신의 삶을 돌아보는 이야기이다. 죽음을 다루었지만 왠지 따뜻한 느낌이 들고 현재에 가장 중요하게 여겨야할 게 무엇인지 생각하게 한다."
양심을 지킨 사람들,김형민,다른,2016,184,"인문사회, 200쪽 이하, 교양","공무원, 비서, 예술가, 학자, 사회운동가, 언론인, 경찰, 변호사, 학생들이 자기 자리에서 옳지 않은 일에 저항하고, 가슴속 양심에 따라 행동한 이야기다. 그래서 이 사람들은 역사에 이름을 남겼다. 박력 있는 삶, 가슴을 뜨겁게 하는 사람을 보면, 우리 삶이 싱싱해진다. 삶에 기운에 필요한 사람이 읽으면 좋다."
양아치의 스피치,"네온비, 김인정",문학동네,2023,272,"기타, 200~300쪽, 만화","비속어와 밈으로 언어생활이 절여져 있던 양아치 남주인공이 첫눈에 반한 여주인공에게 고백하고 이야기를 나누기 위해 자신의 언어생활을 돌아보고 말을 어떻게 해야 하는지 스스로 고민하는 이야기. 웹툰이라 학생들의 접근이 편함. 단, 시간이 갈수록 책에 실린 여러 밈들이 사어(死語)가 될 가능성이 높아 활용하기 어려울 수 있음."
양아치의 스피치,"네온비, 김인정",문학동네,2023,272,"기타, 200~300쪽, 만화","비속어와 밈으로 언어생활이 절여져 있던 양아치 남주인공이 첫눈에 반한 여주인공에게 고백하고 이야기를 나누기 위해 자신의 언어생활을 돌아보고 말을 어떻게 해야 하는지 스스로 고민하는 이야기. 웹툰이라 학생들의 접근이 편함. 단, 시간이 갈수록 책에 실린 여러 밈들이 사어(死語)가 될 가능성이 높아 활용하기 어려울 수 있음."
어느 날 가족이 되었습니다,박현숙,서유재,2018,174,"기타, 200쪽 이하, 시","서민이는 엄마, 아빠가 돌아가신 후 고모 집에 가면서 마미(반려견)을 데려간다. 고모 아들인 민준이는 서민이를 괴롭히려 마미를 밖으로 데려가 버리는데, 과연 둘은 다시 만날 수 있을까? 서민-마미의 교차되는 시점이 흥미롭다."
어느 물푸레나무의 기억,박건웅,북멘토,2015,304,"인문사회, 300쪽 이상, 만화",보도 연맹 학살 사건.
어느 책 수선가의 기록,재영 책수선,위즈덤하우스,2021,328,"문학, 300쪽 이상, 에세이","점점 수선하는 곳이 사라지고 있다. 수선하고 수리한다는 것은 지금까지 사물이, 사물을 간직했던 사람이 보낸 시간을 존중하는 행위라는 것을 이 책을 읽으며 깨달았다. 그리고 자신이 소중하게 간직했던, 그러나 지금은 사라진 것들을 떠올리는 시간이 될 것이다."
어디로 가고 싶으신가요 (바깥은 여름),김애란,문학동네,2017,,"문학, 200~300쪽, 소설",사랑하는 사람을 잃어버린 사람이 그 상처를 어떻게 안고 살아가고 또 극복하는지 보여줌. 소설집 전반에 드리운 상처와 죽음에서 삶 쪽으로 한발 나아간다.
어디서 살 것인가,유현준,을유문화사,2018,380,"인문사회, 300쪽 이상, 교양","이 책에서 저자는 ""어디서"", ""어떻게""라는 질문을 던지며 우리가 앞으로 만들어 나갈 도시를 이야기한다. '어디서'는 '어떤 공간이 우리를 행복하게 만드는가'라는 자문의 의미를 담고 있다."
어떤 양형 이유,박주영,모로,2023,296,"인문사회, 200~300쪽, 교양",양형 이유'는 판사가 형벌의 양을 정한 이유에 대해 기술하는 것으로 형식에 구애받지 않고 판사의 생각을 표현할 수 있는 유일한 공간이다. 박주영 판사는 형사재판을 하며 사건 당사자나 사회에 특별히 전하고 싶은 말이 있을 때 양형 이유를 공들여 적었다.
어떤 호소의 말들,최은숙,창비,2022,236,"인문사회, 200~300쪽, 교양",인권위 조사원으로서 법의 사각지대에 놓인 이들을 만나온 이야기. 저자가 20여년 간 조사관으로 일하며 만난 피해자들과 그 사연을 바라보는 다정한 마음을 담았다.
어떻게 쓰지 않을 수 있겠어요,이윤주,위즈덤하우스,2021,240,"문학, 200~300쪽, 에세이",괜찮아 이따 집에 가서 글을 쓰면 돼. 라고 생각하고 쓰면서 견뎠던 화자의 일상답게 글들이 섬세하고 아리다. 나는 무엇으로 나를 치유하면 좋을까 생각해볼 수 있다.
어른의 그림책,황유진,메멘토,2019,352,"문학, 300쪽 이상, 에세이","문학을 전공했으나 문학과 관련없는 일을 하다가 그림책과 사랑에 빠져, 그림책을 읽고 강연을 하며 살아가는 저자의 그림책 이야기, 좋은 그림책 목록은 덤으로 얻는다."
어른이 되면,장혜영,시월,2020,288,"문학, 200~300쪽, 에세이","언니 혜영은 시설에 있던 발달장애인 동생 혜정을 데리고 나와 함게 살아가기로 결심한다. 혜정은 자신의 삶을 한 번도 자기가 선택한 적이 없음을 깨달았기 때문이다. 두 자매의 다정한 일화를 통해 돌봄과 차별의 문제에 대해 곰곰히 생각하게 된다. 책을 읽고 나면 자매가 무사히 할머니가 되기를 응원하는 마음, 장애인과 친구가 되고 싶은 마음이 피어난다."
어른이 되면 고민이 끝날까?,황효진,창비,2023,156,"문학, 200쪽 이하, 에세이","청소년들이 안고 있을 진로, 재능, 우정, 사랑, 가족, 돈 등 여러 가지 고민에 관한 생각을 나눈다. 이 책을 펼칠 누군가가, 책을 읽는 동안에는 각자의 자리에서 조금은 덜 외롭기를 바라며 다정한 위로를 건넨다."
어린이라는 세계,김소영,사계절,2020,260,"문학, 200~300쪽, 시","어린이 독서교실의 교사인 저자가 아이들과의 만남에서 깨달은 바를 기록했다. 이 책을 읽으면 어린이라는 세계를 통해 세상을 다시 보게 된다. 가독성이 높고 귀여운 책인데, 다 읽고나면 가슴께가 묵직해진다."
어쨌거나 스무 살은 되고 싶지 않아,조우리,비룡소,2019,228,"문학, 200~300쪽, 소설","고등학교 2학년 같은 반 여섯 명이 등장하는 일곱 개의 이야기, 저마다 가진 내밀한 사연이 심상치 않다. 통과의례를 치르듯 혹독한 일들을 겪어 내지만, 섬세한 심리 묘사와 위트있는 작가의 시선이 같은 시기를 보내는 십대들에겐 위로와 용기를 준다."
어쨌거나 스무살은 되고 싶지 않아,조우리,비룡소,2019,228,"문학, 200~300쪽, 소설",고등학교 2학년 같은 반 6명 아이들의 이야기가 7편의 연작소설로 이어진다. 본격 고등학생을 위한 소설이라고 해야 할까? 어쩜 이렇게 저마다의 사연이 깊고 내밀한지. 혹독한 그 시절에 단 한 명이라도 있어주길 바라는 작가는 웃음과 진지함을 넘나드는 세련된 이야기꾼.
어쩌다 정신과 의사,김지용,심심,2020,328,"문학, 300쪽 이상, 에세이",정신과 의사 혹은 심리상담에 관심 있는 친구들에게 권하는 책. 현직 정신과 의사가 정신과 의사라는 직업의 특성과 정신과 질환에 대해 쉽게 설명했다. 읽고 나면 정신과나 정신과 의사에 대한 두려움이 조금은 줄어들 것이다.
어항에 사는 소년,강리오,소원나무,2019,232,"문학, 200~300쪽, 소설",열 네살 영유는 학교를 다니지 못하고 집에 갇혀 지낸다. 사채업자에게 쫓기는 힘든 삶에 엄마는 영유를 손찌검한다. 영유는 어항에 키우는 물고기를 친구로 여기며 지내는데 그 앞에 진짜 친구가 될지도 모르는 현재가 나타난다. 마음이 따뜻한 현재와 의리있는 중국집 배달일 하는 형 덕분에 영유는 용기를 내서 집을 벗어나게 된다.
어항에 사는 소년,강리오,소원나무,2019,232,"문학, 200~300쪽, 소설",열 네살 영유는 학교를 다니지 못하고 집에 갇혀 지낸다. 사채업자에게 쫓기는 힘든 삶에 엄마는 영유를 손찌검한다. 영유는 어항에 키우는 물고기를 친구로 여기며 지내는 그 앞에 진짜 친구가 될지도 모르는 현재가 나타난다. 마음이 따뜻한 현재와 의리있는 중국집 배달일 하는 형 덕분에 영유는 용기를 내서 집을 벗어나게 된다.
언니(대가 없는 일),김혜지,민음사,2021,,"문학, 200~300쪽, 소설","나'는 맘카페 모임에서 '모찌하은맘'을 만난다. 부유한 하은맘은 딸이 쓰던 고가의 육아용품이나 사치품을 아낌없이 '나'에게 양도한다. '나'는 그녀를 언니라 부르며 친해지는데 어쩐지 어렵다. 그러다 그녀의 비밀을 알게 되어 더욱 친근함을 느끼지만, 오히려 사이는 멀어지고, 무시 당한 '나'는 하은맘에게 그녀의 비밀과 같은 방식으로 복수한다."
"언니, 같이 가자!",안미선,삼인,2016,312,"인문사회, 300쪽 이상, 교양",성매매 여성들을 그곳에서 벗어나게 하려고 돕는 활동가들의 이야기.
"언니, 나랑 결혼할래요?",김규진,위즈덤하우스,2020,216,"문학, 200~300쪽, 에세이",당당하게 동성애자임을 밝힌 저자가 미국에 가서 동성결혼을 하고 돌아온 이야기를 책으로 엮어냈다. 자신의 학창 시절부터 겪은 이야기를 솔직하게 알려주어 학생들이 쉽게 이해할 수 있다.
언다잉,앤 보이어,플레이타임,2021,325,"인문사회, 300쪽 이상, 교양",한나 아렌트가 '가장 사적이면서 가장 전달할 수 없는 경험'이라고 표현한 '고통'의 '실재'를 잘 담은 책. 유방암이라는 개인의 질병과 고통이 우리 사회를 통과할 때 만나게 되는 모습들이 잘 드러나 있다.
언어는 인권이다,이건범,피어나,2017,312,"인문사회, 300쪽 이상, 교양",어려운 말이 민주주의를 해칠 수 있음을 알고 이를 바꾸기 위해 노력한 국어학자가 쓴 책. 과거 한자 병기와 마찬가지로 오늘날은 외국어 남용이 누군가에게는 인권 침해가 될 수 있음을 지적한다. 언어보다는 국어 사용에 집중해서 읽을 수 있는 책.
언어의 높이뛰기,신지영,인플루엔셜,2021,248,"인문사회, 200~300쪽, 교양",아무 생각 없이 내뱉는 우리말의 어휘들이 우리 안의 차별을 공고화할 수 있다? 우리가 사용하는 언어들을 성찰하고 좀더 품위있게 타인과 소통할 수 있는 방안을 제시한 책.
언어의 높이뛰기,신지영,인플루엔셜,2021,248,"인문사회, 200~300쪽, 교양",아무 생각 없이 내뱉는 우리말의 어휘들이 우리 안의 차별을 공고화할 수 있다고? 우리가 사용하는 언어들을 성찰하고 좀더 품위있게 타인과 소통할 수 있는 방안을 제시한 책.
얼음붕대 스타킹,김하은,바람의아이들,2014,216,"문학, 200~300쪽, 소설",성폭행을 당할 뻔한 여고생에게 벌어지는 이야기. 상처를 치유하는 스위치가 무엇인지 생각해본다. 제법 귀여운 남사친의 존재는 이 소설의 한계이자 재미라는 학생들의 평.
얼토당토 않고 불가해한 슬픔에 관한 1831일의 보고서,조우리,문학동네,2022,208,"문학, 200~300쪽, 소설",내가 게임에 빠져 있는 사이 휴가지에서 갑자기 동생이 사라졌다. 그 이후로 부모님은 사라진 동생을 찾느라 삶이 엉망이 된다. 살다 보면 누구나 예기치 못한 '불가해한' 슬픔에 닥치게 된다. 그 슬픔은 갑자기 치유되는 것이 아니다. 살아가면서 슬픔은 서서히 견딜 만해지는 것이다.
얼토당토않고 불가해한 슬픔에 관한 1831일의 보고서,조우리,문학동네,2022,208,"문학, 200~300쪽, 소설",내가 게임에 빠져 있는 사이 휴가지에서 갑자기 동생이 사라졌다. 그 이후로 부모님은 사라진 동생을 찾느라 삶이 엉망이 된다. 살다 보면 누구나 예기치 못한 '불가해한' 슬픔에 닥치게 된다. 그 슬픔은 갑자기 치유되는 것이 아니다. 살아가면서 슬픔은 서서히 견딜 만해지는 것이다.
엄마 마중,이태준,보림,2013,36,"기타, 200쪽 이하, 소설",소설가 이태준이 쓰고 김동성이 그린 ‘엄마 마중’. 하루종일 추위 속에서 천진하게 엄마를 기다리는 아이의 빨간 손 빨간 코 귀여운 몸집이 애잔하다. 글밥이 없는 마지막 장은 그림 그린 사람이 보탠 것일 텐데 현실 같기도 하고 환상 같기도 한 아름다운 장면이다. 이 아이가 자라 기형도의 ‘엄마 걱정’ 속 화자가 되지 않았을까 상상하게 된다.
엄마가 수놓은 길,재크린 우드슨,알에이치코리아,2022,48,"기타, 200쪽 이하, 교양",흑인 여성들이 자유를 향한 역사를 그려낸 이야기로 자유를 찾아 떠나는 길에 하늘에 보인 달과 별을 수 놓는 법을 자손들에게 전해주며 고귀한 정신이 이어지는 감동을 느낄 수 있다.
