title,author,publisher,year,pages,tags,description
0에서 9까지(오늘의 SF 2호),고호관,아르테,2020,,"문학, 200~300쪽, 소설",백수인 현진은 어느날 0에서 9까지 무작위로 입력만 하는 알바를 하게 된다. 인공지능이 인간 행동을 예측하는 데이터 연구였는데 다른 사람들과 다르게 현진의 행동은 인공지능이 전혀 예측하지 못한다. 인공지능과 인간의 다른 점이 무엇일지 조금 재밌게 뒤틀어보는 소설.
100℃,최규석,창비,2017,211,"인문사회, 200~300쪽, 만화",610 민주항쟁 (영화 '1987')
10대 마음 보고서,따돌림사회연구모임,마리북스,2017,272,"인문사회, 200~300쪽, 교양",센 척하는 청소년들을 어떻게 가르쳐야 하는지 잘 나와 있다. 중고등학교 선생님 6분이 집필한 책으로 아이들과의 관계 맺기 방법을 생각해볼 수 있다.
10대를 위한 사랑학개론,정연희 외,꿈결,2014,232,"인문사회, 200~300쪽, 교양","짝사랑, 습관성 연애, 데이트 폭력, 아름답게 헤어지는 법, 사이버 성폭력, 포르노 중독, 동성애, 성형수술처럼 십대들이 겪거나 생각해보는 일들을 아주 쉽게 씀."
10대와 통하는 기후 정의 이야기,"권희중, 신승철",철수와영희,2021,204,"기타, 200~300쪽, 교양",기후 위기로 발생하는 불평등한 구조를 정의롭게 극복하려는 기후 정의에 관해 쉽게 알려 주고 있다.
10대와 통하는 동물 권리이야기,이유미,철수와영희,2017,200,"인문사회, 200쪽 이하, 교양",동물을 왜 학대하면 안 되는지 알기 쉽게 설명한 책. 동물들의 최소한의 권리를 지키기 위해 인류가 책임을 다한다면 인류와 동물이 평화롭게 공존하는 세상을 만들 수 있다고 말한다.
10대와 통하는 땅과 집 이야기,손낙구,철수와영희,2013,200,"인문사회, 200쪽 이하, 교양","초등학생 때부터 주거 형태에 따라 서로를 구별짓는 한국 사회의 부동산 문제를 청소년의 눈높이에서 다룬 책, 저자는 지구의 한 귀퉁이에 금을 긋고 '여기는 내 꺼야'라고 주장하는 게 그렇게 당연한 일인가 묻는다. 사람이 사는 데 땅이 어떤 의미인가 하는 원론부터 집값이 왜 오르내리는지, 다른 나라 사람들은 집을 어떻게 구해서 사는지, 주거 문제에 관한 우리의 현실을 낯설게 볼 수 있는 기회를 열어준다."
10대와 통하는 일하는 청소년의 권리 이야기,이수정,철수와영희,2015,180,"인문사회, 200쪽 이하, 교양",알바 하는 청소년들이 알아두면 큰 도움이 되는 노동법 상식을 정리했다.
10대와 통하는 탈핵 이야기,최열 외,철수와영희,2014,172,"과학, 200쪽 이하, 시","핵에너지에 대해 환경운동가, 의사, 도시 공학자, 역사학자, 기자가 모여서 최신 정보를 알려준다. 미국에서는 더 이상 핵발전소를 안 짓는 이유가 무엇일까? 프랑스와 독일의 사례를 소개하고 있다."
10대와 통하는 환경과 생태 이야기,최원형,철수와영희,2015,264,"기타, 200~300쪽, 교양",자연환경과 조화를 이루며 사는 삶의 방식을 잘 설명한다. 청소년들이 일상 생활에서 쉽게 실천할 수 있는 방안도 소개한다.
1등에게 박수 치는 게 왜 놀랄 일일까?,오찬호,나무를심는사람들,2017,200,"인문사회, 200쪽 이하, 교양","우리는 왜 사회에 관심을 가져야 하는지, 인간은 역사와 문화를 어떻게 만들어 왔는지, 우리가 사는 세상은 평등한지, 학교에서는 무슨 일이 벌어지고 있는지, 세계인이 함께 풀어야 할 숙제는 무엇인지에 대해 질문하고 답한다. 차별, 혐오, 인권에 대한 이야기가 주제에 따라 짧고 쉽게 나와 있어서 중학생이 읽기에 적당하다."
1분,최은영,시공사,2017,220,"문학, 200~300쪽, 소설","유수, 서연, 보미는 써버의 팬클럽, 손꼽아 기다리던 공연 당일, 공연 장소인 서진타운 서진홀에서 예상치도 못했던 큰 사고가 일어난다. 무대 앞자리 펜스를 잡았다고 좋아하던 것도 잠깐, 셋의 운명은 잔인하게 갈리는데. 삼풍백화점 붕괴를 모티브로 쓴 소설."
1의 들러리,김선희,소원나무,2019,232,"문학, 200~300쪽, 소설",절대 바뀔 것 같지 않은 부조리한 현실을 바꾸기 위해 자신들만의 방식대로 맞서 싸운 용감한 ‘들러리’ 10대들의 통쾌한 행동을 보면서 적당히 타협하고 외면하면서 살아가는 우리의 삶을 되돌아보게 된다. 처음부터 사건이 굉장히 속도감있게 진행된다.
1의 들러리,김선희,소원나무,2019,232,"문학, 200~300쪽, 소설",절대 바뀔 것 같지 않은 부조리한 현실을 바꾸기 위해 자신들만의 방식대로 맞서 싸운 용감한 ‘들러리’ 10대들의 통쾌한 행동을 보면서 적당히 타협하고 외면하면서 살아가는 우리의 삶을 되돌아보게 된다. 처음부터 사건이 굉장히 속도감있게 진행된다.
20 vs 80의 사회,리처드 리브스,민음사,2019,272,"인문사회, 200~300쪽, 교양",중상류층을 중심으로 불평등 문제를 분석한 책. '유리바닥'이라는 개념을 들어 누구나 계층이동이 가능한 사회가 바람직하다고 말하면서도 정작 자기 자녀의 '하향 이동'을 받아들이려는 사람은 드문 현실을 비판한다. 가볍지 않은 주제인데도 저자의 글솜씨 덕에 술술 잘 읽힌다.
20 vs 80의 사회,리처드 리브스,민음사,2019,272,"인문사회, 200~300쪽, 교양",중상류층을 중심으로 불평등 문제를 분석한 책. '유리바닥'이라는 개념을 들어 누구나 계층이동이 가능한 사회가 바람직하다고 말하면서도 정작 자기 자녀의 '하향 이동'을 받아들이려는 사람은 드문 현실을 비판한다. 가볍지 않은 주제인데도 저자의 글솜씨 덕에 술술 잘 읽힌다.
25년간의 수요일,윤미향,사이행성,2016,312,"인문사회, 300쪽 이상, 교양","1992년 시작된 수요 시위는 무려 25년째 하루도 빠짐없이 이어져오고 있다. 일본군 위안부 할머니들이 어떻게 처절한 고통의 역사 속에 휘말리게 되었고, 해방 후 50여년 동안 이어진 긴 절망의 세월을 깨고 어떻게 진실이 세상에 밝혀지게 되었는지, 그 침묵과 고백의 역사를 생생하게 들려준다."
2미터 그리고 48시간,유은실,낮은산,2018,160,"문학, 200쪽 이하, 소설",갑상선기능항진병으로 눈이 튀어나오는 증상을 치료하기 위해 방사능요오드 치료를 받고 48시간 동안 모든 사람들과 2미터를 유지해야 하는 여자아이와 2미터 거리를 두고 친구를 돌봐주는 친구와의 우정을 그린 이야기. 환자의 외로움과 병에 대한 이해가 깊어진다.
36.4℃,"배창환, 조재도",작은숲,2012,260,"문학, 200~300쪽, 시",1980년대 중반부터 2000년대까지 30여년 동안 교실에서 학생들이 쓴 시 중에서 학생들이 뽑은 시 모음집. 학생들의 시선으로 바라본 세상의 모습이 잘 담겨 있다.
42가지 마음의 색깔,"크리스티나 누녜스 페레이라, 라파엘 R. 발카르셀",레드스톤,2015,96,"기타, 200쪽 이하, 교양","교구로 많이 활용되는 감정 카드를 그림책으로 만든다면 이 책이지 않을까. 42가지 감정의 정체를 아주 쉽고 단순하지만 사전적 정의보다 훨씬 울림있고 정확하게 풀어냄. 읽으면서 내가 느끼는 감정을 인식하고, 그 감정에 대해 고민하고 이야기해볼 수 있는 계기를 줄 수 있는 책."
42가지 마음의 색깔 2,크리스티나 누녜스 페레이라 & 라파엘 R. 발카르셀,레드스톤,2015,96,"기타, 200쪽 이하, 교양",사랑의 색깔편이라는 부제처럼 사랑을 느낄 수 있는 단어와 설명을 기분 좋은 삽화와 함께 그려냈다.
50일간의 썸머,유니게,특별한 서재,2021,176,"문학, 200쪽 이하, 소설","인공지능 로봇과의 인간의 소통을 다룬 이야기, 관계에 실패와 상처를 가진 주인공들에게 나만의 친구가 되어주는 썸머, 과연 진정한 우정은 무엇일까? 갈등없이 나를 온전히 받아주는 관계가 과연 이상적인 걸까? 생각하게 된다."
5번 레인,은소홀,문학동네,2020,240,"문학, 200~300쪽, 소설","수영을 사랑하는 나루는 초등학교 5학년 때 초희에게 1등을 놓친 뒤로 더욱 열심히, 부지런히 연습을 한다. 초희를 이기고 싶은 욕심에 합동연습에서 얼결에 초희의 수영복을 숨긴 후, 본선 대회가 다가올수록 나루 마음은 초조해지는데. 당당하게 지는 법을 배우는 싱그러운 13살 수영 꿈나무들의 이야기."
"5월 18일, 맑음",임광호 외,창비,2019,256,"인문사회, 200~300쪽, 시",5.18 민주항쟁을 어떻게 설명하면 좋을까? 고민하는 교사와 5.18이 궁금한 청소년들에게 반가운 책이다. 1980년 당시 광주에서 어떤 일이 있었는지를 객관적인 자료를 제시하면서 알기 쉽게 설명한다.
7년 동안의 잠,박완서,어린이작가정신,2015,40,"과학, 200쪽 이하, 교양",흉년에 시달리던 개미가 찾아온 먹이는 매미 번데기였다. 먹이를 찾기 힘들고 매미가 되어 날아가기도 힘든 건 뒤덮인 도로 때문이라는 통찰을 가진 나이 많은 개미를 따라 부드러운 땅으로 번데기를 옮겨 주고 번데기는 매미가 되어 날아간다. 개미들은 배고프지만 매미를 축복한다.
82년생 김지영,조남주,민음사,2016,192,"문학, 200쪽 이하, 소설",34살 김지영 씨가 갑자기 이상 증세를 보인다. 그녀의 정신 상담 내용(인생 궤적)을 재구성해 기록한 리포트 형식의 소설로 대한민국에서 여성을 어떻게 대해 왔는지에 대해 생생하게 보여준다. 책을 읽으면 여성을 이해하고 포용하게 된다.
82년생 김지영,조남주,민음사,2016,192,"문학, 200쪽 이하, 소설",34살 김지영 씨가 갑자기 이상 증세를 보인다. 그녀의 정신 상담 내용(인생 궤적)을 재구성해 기록한 리포트 형식의 소설로 대한민국에서 여성을 어떻게 대해 왔는지에 대해 생생하게 보여준다. 책을 읽으면 여성을 이해하고 포용하게 된다.
90일 밤의 우주,"김명진, 김상혁 외",동양북스,2023,498,"과학, 300쪽 이상, 교양",한국천문연구원 천문학자들이 풀어내는 우주의 신비 이야기. 이 책을 읽기 전과 후의 밤하늘은 각각 달라보일 것이다.
99%를 위한 경제학,김재수,생각의힘,2016,384,"인문사회, 300쪽 이상, 교양",경제학의 개념을 우리 주변의 사건과 연관 지어서 설명한 책
9번의 일,김혜진,한겨례,2019,260,"문학, 200~300쪽, 소설",통신회사 현장팀에서 일하던 '나'는 저성과자로 분류되어 원치 않는 부서 발령이 난다. 자신에게 익숙하지 않은 일을 계속 해나가면서 그저 '일'을 붙들고 싶었던 그는 나락으로 떨어진다.
9번의 일,김혜진,한겨레 출판,2019,260,"문학, 200~300쪽, 소설","자신의 일에 대해 자부심을 가졌고, 일 하지 않는 자신은 생각조차 할 수 없는 주인공은, 권고사직을 거부하면서 다른 업무, 지방 등으로 점차 밀려나다 마침내 타인의 삶의 자리까지 위협하는 일을 하게 된다.인간에게 일이란 무엇인지 그 의미를 묵직하게 묻는 소설이다."
A군의 인생 대미지 보고서,강석희 외,창비교육,2022,212,"문학, 200~300쪽, 소설","교실 안에서 일어나는 일 뿐만 아니라 사이버 폭력, 데이트 폭력까지 다양한 층위의 학교 폭력을 다룬 단편집."
"B끕 언어, 세상에 태클 걸다","권희린, 이주윤",우리학교,2018,272,"인문사회, 200~300쪽, 교양",학생들이 자주 쓰는 비속어에 대한 설명과 어원이 잘 드러난 책. 순화어도 함께 적혀 있어 학생들과 읽으면서 요즘 학생들이 쓰는 비속어나 밈에 대해 한 번 더 생각해 볼 수 있게 해준다.
EBS 다큐프라임 자본주의,EBS 자본주의 제작팀,가나출판사,2013,388,"인문사회, 300쪽 이상, 교양","쉬지 않고 일하는데 나는 왜 이렇게 살기 힘든가?' 라는 질문을 던지고 그 답이 자본주의라는 구조 속에 있다는 것을 세계 석학들과의 인터뷰를 통해 밝히고 있다. 그냥 좌절하기보다는 원인을 파악해서 자본주의에 대처하는 힘과 용기, 능력을 기르자는 게 이 책의 취지이다. 자본주의 제도 아래 대부분 성실한 노동자로 살아갈 아이들이 알아야 할 자본주의의 비밀이 자세히 설명되어 있다."
EBS 당신의 문해력,김윤정,EBS BOOKS,2021,296,"인문사회, 200~300쪽, 교양","2021년 EBS 6부작 프로그램 <당신의 문해력>의 내용을 글로 옮겨 펴낸 책이다. 영유아기, 학령기, 청소년기를 나누고 시기별 문해력의 중요성을 설명한다. 시기별 문해력을 높이는 실질적인 해법을 사례로 제시하고 있다."
Lo-fi,강성은,문학과지성사,2018,96,"문학, 200쪽 이하, 시",꿈의 세계 같기도 하고 죽음의 세계 같기도 한 몽환적인 시공간에서 펼쳐지는 시가 많다. 고스트라는 동명의 시가 여러 편 실린 점도 흥미롭다.
N분의 1을 위하여,김지숙 외,창비교육,2022,224,"문학, 200~300쪽, 소설",고졸 취업 문제를 테마로 한 단편소설집. 특성화고 실습생이나 고졸 취업생들이 어른들의 부주의와 이기적인 욕심으로 안타깝게 희생당하는 일이 아직도 계속 일어나고 있다. 이제는 모른 척 할 수 없는 우리가 해결해야할 문제라는 걸 가슴 아프게 깨닫게 된다.
가난의 문법,소준철,푸른숲,2020,304,"인문사회, 300쪽 이상, 교양","폐지 줍는 노인들에 대한 보고서다. 도시에서 가난한 노인들이 어떻게 사는지 알게 된다. 문제만 드러내지 않고, 가난한 노인들을 도우려는 사회의 여러 시도를 정리해두어서 좋다. 이 책을 다 읽으려면 끈기가 약간 필요하다."
가난한 아이들은 어떻게 어른이 되는가,강지나,돌베개,2023,279,"인문사회, 200~300쪽, 교양",한 아이를 키우는 데 온 마을이 함께하지 못하고 있는 것처럼 보이는 현대 사회에서 아이들이 어떻게 어른이 되는지를 보여준다. 고등학생 정도라면 이러한 사회 구조에 문제 의식을 가지고 연대의 필요성을 인식할 것이다.
가능주의자,나희덕,문학동네,2021,172,"문학, 200쪽 이하, 시",세상의 낮은 부분에 대해 꾸준히 들여다보는 시인 나희덕의 시집. 최근의 사건들에 대한 시인의 단상들도 엿보며 스스로 돌아보게 된다.
가르칠 수 있는 용기,파커 J. 파머,한문화,2013,376,"인문사회, 300쪽 이상, 에세이",마음이 지친 많은 교사들에게 위로를 준 교육에세이.
가리는 손 (바깥은 여름),김애란,문학동네,2017,,"문학, 200~300쪽, 소설","노인을 폭행한 청소년들 주변에서 손을 가리고 웃던 아들의 모습을 CCTV에서 본 어머니가 서술자이다. 맛있는 집밥을 만드는 장면과 혼혈아인 아들과 살아가는 이야기가 절묘하게 교차한다. 시의성 있는 사건과 그 이후에, 그리고 그 주변에서 어떤 일들이 벌어지는지 생생하게 그려낸다."
가만한 나날 (가만한 나날),김세희,문학동네,2019,,"문학, 200~300쪽, 소설",자신도 모르는 사이에 죽음을 부르는 상품을 블로그로 소개하였던 내가 겪는 혼란스러움을 이야기한다.
가만한 당신,최윤필,마음산책,2016,360,"인문사회, 300쪽 이상, 에세이",콩고의 마마 - 레베카 마시카 카추바' 전쟁의 무참함 속에서 인간의 존엄성을 지키고자 하는 이야기.
가만히 좋아하는,김사인,창비,2006,154,"문학, 200쪽 이하, 시",작은 생명 하나도 애정어린 시선으로 바라보는 시인의 마음이 잘 표현된 시집
가슴 뛰는 소설,최진영 외,창비교육,2020,328,"문학, 300쪽 이상, 소설",다양한 사랑의 모양을 아름답게 그려낸 단편 소설을 엮은 책. 달콤한 로맨스를 기대하고 책을 펼친 학생들에게 큰 충격과 고민을 안겨주는 단편 소설집. 우리가 가진 사랑의 모양이 얼마나 단편적이고 고정적인지 의심하게 만드는 대화를 자연스럽게 주고 받을 수 있다.
가장 나다운 거짓말,배수연,창비교육,2019,124,"문학, 200쪽 이하, 시",어딘가 이상하고 서툰 청소년기의 마음을 솔직하게 그렸다. 나만 이상한가? 생각했던 마음을 시에 기대며 공감하게 된다.
가재가 노래하는 곳,델리아 오언스,살림,2019,464,"문학, 300쪽 이상, 소설",생태학자가 쓴 소설이라 곳곳에 아름다운 자연 묘사가 펼쳐진다. 늪에서 일어난 살인 사건의 비밀을 뒤쫓아가는 스토리라 아이들이 쉽게 몰입할 수 있으며 사랑 이야기가 재미를 더한다. 책을 읽는 즐거움 그 자체에 몰입할 수 있는 책.
가족각본,김지혜,창비,2023,248,"인문사회, 200~300쪽, 교양",동성애 결혼 이야기로 시작하여 가족에서 배제되는 사람들 이야기를 들려주며 정상 가족에 대한 편견을 들여다보게 하는 책이다. 단순히 가족 이야기에 머무는 것이 아니라 가족 내 차별이 사회적 차별로 어떻게 이어지는지 들여다볼 수 있다.
가족의 발견,최광현,부키,2014,288,"인문사회, 200~300쪽, 에세이","자녀는 부모의 ‘투사의 그릇’이 되며, 무의식적으로 자녀는 부모의 좌절된 꿈과 욕망까지 알게 된다고 한다. 왠지 내가 부모의 뜻대로 살고 있는 것처럼 느껴지는 친구들이 읽어 보면 좋다."
가짜 뉴스 시대에서 살아남기,류희림,글로세움,2018,296,"인문사회, 200~300쪽, 교양","이른바 가짜 뉴스라고 일컫는 허위 정보들이 왜 이렇게 난무하는지를 밝히고, 가짜 뉴스가 사회에 미치는 영향을 구체적인 사례 중심으로 정리했다. 가짜 뉴스에 사용되는 언어를 분석하고, 앞으로 언론이 나아갈 바에 대해 논의하고 있는 책."
가치를 가르칩니다,경기도중등독서교육연구회,서해문집,2019,340,"인문사회, 300쪽 이상, 교양",6가지의 통합수업 사례가 담긴 책. '통합수업준비과정-교과별 수업내용-에필로그'로 구성되어 있다. 주제통합수업을 준비하는 선생님들께 추천한다.
각각의 계절,권여선,문학동네,2023,276,"문학, 200~300쪽, 소설","믿고 읽는 작가 권여선의 소설집. 전작인 <안녕, 주정뱅이>의 고통과 절망을 견뎌 낸 인물들이 이제는 <각각의 계절>을 지나면서 조금씩 달라지는 삶의 모서리를 정확한 문장으로 보여준다."
감기 걸린 물고기,박정섭,사계절,2016,56,"기타, 200쪽 이하, 교양",어디서 온 지 모르는 거짓말이 작은 물고기들 사이를 갈라 놓고 결국 모두 큰 물고기에게 잡아 먹히게 된다. 해파리가 코를 간지럽혀 재채기를 한 큰 물고기 덕분에 작은 물고기들은 살아나게 되고 힘을 모아 큰 물고기를 쫓아 낸다.
감정을 할인가에 판매합니다(감정을 할인가에 판매합니다),이세형,네오픽션,2022,,"문학, 200~300쪽, 소설",사람들은 감정을 판매하고 그 감정을 판 사람은 관련된 경험을 할 수 없게 되며 오히려 돈을 주고 감정을 겪으려고 하는 사람들이 많아지는 세상이 된다. 인공지능과 함께 살게 될 미래에 대해 생각해볼 수 있게 하는 소설
"강남역 10번 출구, 1004개의 포스트잇",경향신문 사회부 사건팀,나무연필,2016,188,"인문사회, 200쪽 이하, 교양","2016년 5월 17일 새벽 1시, 23세의 한 여성이 살해된 인근의 강남역 10번 출구의 외벽에 붙은 포스트잇 1004건의 채록물. 여성 혐오에 대한 문제의식을 토로한 짧은 글들이다."
개똥 세 개,이정범 외,북멘토,2013,360,"문학, 300쪽 이상, 에세이","강수돌, 안건모, 홍세화 등 유명인들이 청소년들에게 인생교훈을 주기 위해 쓴 짧은 글 모음."
"거기 내가 가면 안 돼요? 1, 2",이금이,사계절,2016,596,"인문사회, 300쪽 이상, 소설","일제강점기(위안부), 해방, 한국 전쟁에 이르는 시기를 여자 아이 '수남'의 시선으로 서술한 역사 소설."
거북이자리,김유진,책읽는곰,2022,48,"기타, 200쪽 이하, 교양",행동이 느린 서우는 거북이가 좋아 종이로 접어 서랍에 바다를 만들어 넣는다. 그러다 서랍 바다로 들어가며 거북이와 좋은 시간을 보낸 후 돌아와 교실에서 거북이를 좋아하는 친구도 생긴다. 일러스트가 아름답다.
거울을 든 아이,안나 회글룬드,곰곰,2022,52,"기타, 200쪽 이하, 교양",괴물을 무찌르러 떠난 아빠를 구원하는 용기 있는 소녀의 감동적인 이야기다. 지혜로 돌이 된 사람들을 구하는 이야기는 빨간망토를 생각나게 한다. 나이와 상관 없는 지혜의 힘이 느껴진다.
"걱정말아요, 그대",JTBC '김제동의 톡투유' 제작진,중앙북스,2016,248,"문학, 200~300쪽, 에세이","김제동의 톡투유' 속 이야기를 엮어낸 에세이집. 일상에 지친 어느 날, 나만의 대나무숲이 필요할 때 도움이 된다."
건너간다,이인휘,창비,2017,324,"문학, 300쪽 이상, 소설",작은 식품공장에서 일하는 사람들이 작업장의 문제를 해결해나가는데 가슴이 두근거리며 읽게 된다.
걷는 사람 하정우,하정우,문학동네,2018,296,"문학, 200~300쪽, 에세이","내가 하정우라면, 돈 많은 연예인이라면 휴식 시간을 어떻게 보낼까? 굳이 이렇게 걷기 강행군을 했을까? 무명 시절부터 걷고 또 걸었던 그만의 걷기 철학을 들어보자. 책을 읽기 전 일단 먼저 걸어도 좋다."
겨울방학,최진영,민음사,2019,304,"문학, 300쪽 이상, 소설","같은 방향으로 걷도록 요구되지만, 각자 다른 모습이기에 자신만의 과제를 해결하기 위해 애쓰는 외로운 사람들의 이야기. 그러나 각자의 과제를 꽉 붙들고 있는 사람들의 모습은 찐하게 아름답다."
겨울방학(겨울방학),최진영,민음사,2019,,"문학, 200~300쪽, 소설","초등학생 이나와 고모가 함께 보내는 겨울 방학 이야기, 이나의 눈에는 고모의 삶이 이상하기만 하다. 텔레비전, 침대, 신발장도 없는 고모는 아침밥도 먹지 않는다. 배려란 밥 먹지 않는 이에게 밥먹으라 떠 먹이는 것만 존재하는 게 아닌, 밥 먹지 않음을 존중하는 마음도 존재함을 알게 하는 소설. 단단한 고모의 삶이 부러워지는 소설이다."
결국 다시 경제민주화다,김종인,박영사,2017,278,"인문사회, 200~300쪽, 교양",헌법에서 보장하는 경제민주화 이야기. 경제민주화에 대한 그릇된 오해와 편견을 바로잡기 위한 책
경년 (현남 오빠에게),김이설,다산책방,2017,,"문학, 200~300쪽, 소설","중학생 '아들'의 충격적인 일탈에 '엄마'는 아들과 관계를 가졌을 여자아이들을 걱정하고, 또 초경을 시작하는 딸아이를 보면 안타깝기만 하다."
경애의 마음,김금희,창비,2018,356,"문학, 300쪽 이상, 소설","회사의 부당해고에 맞선 파업 중 일어난 성폭행에 대한 고발, 친한 친구의 사고, 연인의 결혼과 계속되는 만남 등으로 인해 자신을 배척하고 손가락질하는 사람들 속에서, 부서지는 마음이지만 폐기하지 않은 채 꿋꿋이 살아가는 경애의 이야기."
경우 없는 세계,백온유,창비,2023,280,"문학, 200~300쪽, 소설","어떤 순간 가출을 결심한 소년이 집을 나와 만나게 된 상황과 이야기. 생생한 심리묘사가 압권이며 청소년 시기 그들의 마음 속 상처와 고민들을 잘 알 수 있는 소설이다. 인물들의 행동과 선택에 대해 이야기할 거리가 많고, 특별한 감동을 준다."
경제를 아십니까,홍은주,개마고원,2020,288,"인문사회, 200~300쪽, 교양",경제학의 여러 개념을 설명한 책. 교과서 내용을 더 자세히 설명한 책
경찰관속으로,원도,이후진프레스,2019,208,"문학, 200~300쪽, 에세이","이 책을 읽고 나면 경찰을 한 인간으로 바라보게 된다. 거짓 신고, 경찰서에 와서 커피를 타 달라는 어이없는 요청에서부터 가정폭력, 살인, 자살, 성폭력에 이르는 강력사건까지 극과 극을 오가는 일들을 처리하는 경찰로서 겪는 애환을, 언니에게 보내는 편지형식으로 서술한다."
고구마와 고마워는 두 글자나 같네,김은지,걷는사람,2019,136,"문학, 200쪽 이하, 시",김은지의 두 번째 시집. 첫 번째 시집의 장점을 유지하면서도 따뜻하게 타자와 함께 하는 상황을 표현한 시가 많다.
