title,author,publisher,year,pages,tags,description
체리새우:비밀글입니다,황영미,문학동네,2019,200,"문학, 200쪽 이하, 소설","이 책은 누구라도 겪었음직한, 현재진행형으로 벌어지는 중2 교실 속 이야기인 듯 생생하다. 책을 읽는 친구들이 타인의 시선에 얽매이지 않고, 나답게! 당당하고 단단하게 살아가길 힘껏 응원해 본다."
체리새우:비밀글입니다,황영미,문학동네,2019,200,"문학, 200쪽 이하, 소설","이 책은 누구라도 겪었음직한, 현재진행형으로 펼쳐지는 중2 교실 속 이야기다. 책을 읽는 친구들이 타인의 시선에 얽매이지 않고, 나답게! 당당하고 단단하게 살아가길 힘껏 응원해 본다."
체리새우:비밀글입니다.,황영미,문학동네,2019,200,"문학, 200쪽 이하, 소설","이 책은 누구라도 겪었음직한, 현재진행형으로 펼쳐지는 중2 교실 속 이야기가 생생하다. 책을 읽는 친구들이 타인의 시선에 얽매이지 않고, 나답게! 당당하고 단단하게 살아가길 힘껏 응원해 본다."
체육복을 읽는 아침,이원재,정미소,2023,296,"인문사회, 200~300쪽, 에세이",정선고 학생부장이자 국어교사인 이원재 선생님이 아이들과의 경험을 기록한 에세이. 이런 교사 동료가 있다는 위로를 얻을 수 있는 힘이 있는 책입니다.
체트니크가 만든 아이,장경선,다른,2023,192,"인문사회, 200쪽 이하, 소설","보스니아 내전의 아픔을 다룬 청소년소설, 전쟁의 땅에서 여성과 아이들이 겪는 참담한 현실을 열다섯 살 나타샤의 이야기로 무겁지 않게 그려냈다."
체트니크가 만든 아이,장경선,다른,2023,192,"문학, 200쪽 이하, 소설",보스니아 내전의 아픔을 다룬 청소년소설. 전쟁의 땅에서 여성과 아이들이 겪는 참담한 현실을 열다섯 살 나타샤의 이야기로 무겁지 않게 그려냈다.
초파리 돌보기(아무것도 아니라고 잘라 말하기),임솔아,문학과 지성사,2021,,"문학, 200~300쪽, 소설","수십 년 동안 일했는데도 오십 대 무경력 주부로 취급받는 '원영'. 대학 연구소에서 삼백 종의 초파리를 관리하던 중 폐기 처분될 초파리를 집으로 가져온다. 원영은 원인을 알 수 없는 병으로 직장은 물론 일상생활까지 힘들어진다. 딸 '지유'는 초파리 실험실을 원인으로 짐작하지만, 원영은 지유의 예상과 전혀 다른 이야기를 꺼낸다. 평생 자기 책상을 가져 보지 못한 채 가족을 위해 희생한 '원영'은 주변에서 만나는 수많은 여성의 또 다른 이름이다. 돌봄 노동에 매여 자기 자신을 잃어버린 '원영'에 대해 이야기 나눌 수 있다."
최미진은 어디로 (누구에게나 친절한 교회오빠 강민호),이기호,은행나무,2018,,"문학, 200~300쪽, 소설",소설가가 자신이 사인을 해준 책을 내다파는 사람에게 자기 책을 사러 가는 이야기이다. 이야기가 무겁지 않으면서도 공감하는 법에 대해 생각할 수 있다.
최미진은 어디로 (누구에게나 친절한 교회오빠 강민호),이기호,은행나무,2018,,"문학, 200~300쪽, 소설",소설가가 자신이 사인을 해준 책을 내다파는 사람에게 자기 책을 사러 가는 이야기이다. 이야기가 무겁지 않으면서도 공감하는 법에 대해 생각할 수 있다.
최선은 그런 것이에요,이규리,문학동네,2014,116,"문학, 200쪽 이하, 시",담백한 표현으로 이해하기 어렵지 않은 시가 많다. 시인이 서술한 솔직한 후회와 깨달음이 독자에게 잔잔하게 전해진다.
최소한의 선의,문유석,문학동네,2021,256,"인문사회, 200~300쪽, 에세이",우리 삶의 모습을 헌법에 비추어 비판적으로 해석한 책이다. 법 해설이 중심이 아닌 우리가 헌법을 바로 알고 기본권을 지키며 살 수 있도록 조언을 주고 성찰하게 한다.
최원형의 청소년 소비 특강,최원형,철수와 영희,2017,229,"기타, 200~300쪽, 교양","지구 온난화부터 코로나까지, 지금 이대로 괜찮지 않다는 건 알겠는데 여전히 잘 모르는 우리들. 왜 이런 사회가 되었는지에 대해 차근차근 이야기해준다. 이 책의 키워드는 쓰레기, 그림자 노동, 포장재, 광고, 경제발전, 지구 생명, 플라스틱, 생태 감수성, 재활용, 마지막에는 실천하는 사람들 인터뷰가 실려있다."
최종경고: 6도의 멸종(구판:6도의 멸종),마크 라이너스,세종서적,"2014
 (2022개정판)",464,"기타, 300쪽 이상, 교양",지구온난화가 얼마나 위험한지 그 예상 피해를 설명한다. 지구의 온도가 1도씩 상승할 때마다 벌어질 일들을 보여준다. 경각심을 불러일으키는 내용이다.
최후의 Z,로버트 C. 오브라이언,비룡소,2015,282,"문학, 200~300쪽, 소설","핵전쟁 이후 지구에서 살아남기 위해 외딴 산골짜기에서 살아가던 주인공이 어느 날 자신의 집 쪽으로 다가오는 한 남자를 발견한다. 이들은 어떻게 될까? 흥미로운 소재로, 학생들이 재미있게 읽는다."
최후의 늑대,멜빈 버지스,푸른나무,2019,224,"문학, 200~300쪽, 에세이",영국 늑대의 마지막 무리가 멸종되어 가는 과정을 그린 이야기.
출근길의 주문,이다혜,한겨레출판,2019,288,"문학, 200~300쪽, 에세이","남성과 여성이 조직/업무를 바라보는 관점, 대응 방식이 꽤 다르다는 생각을 자주 한다. 여성이 좀더 각개전투하는 느낌이랄까, 혼자 알아서 헤쳐나가는 경향이 있다. 외로운 싸움을 하는 느낌이다. 그러다보면 “오래 직장에 남아 있을 수 없다”는 것이 작가의 문제의식. 일하는 여성이 일터에서 어떤 마음을 가져야 하는지, 어떤 방식으로 말과 글을 사용해야 하는지, 소통과 연대의 장을 어떻게 만들 것인지를 알려주는 책. “여성이여, 직장에서 사라지지 말아라.”"
충실한 마음,델핀드비강,레모,2022,224,"문학, 200~300쪽, 소설","학교에서조차 몰래 술을 마실 정도로 중독 증세가 심한 테오. 그는 이혼한 부모로부터 방치와 학대를 당하고 있다. 그의 무기력과 변화에 주목한 교사 엘렌, 친구를 위해서라면 거짓말도 서슴지 않는 마티스, 아이들의 상황을 알게 되어 혼란스러워 하는 세실. 네 사람의 이야기가 중첩되는 소설. 책은 독자에게 어린 시절과 현재의 삶에 대해 계속해서 질문을 던진다. 일상의 폭력 앞에 우리는 어떤 태도로 살고 있는지."
친애하고 존경하는(친애하고 존경하는),박성희,위즈덤하우스,2023,,"문학, 200~300쪽, 소설",형식과 절차만을 중시하며 장학금을 떠넘기는 어른들의 무례한 동정을 담담하게 거절하는 민우 이야기.
친애하는 나의 민원인,정명원,한겨레출판,2021,324,"문학, 300쪽 이상, 에세이","저자는 16년차 여성 검사, 권력의 중심인 특수부, 공안부가 아닌 형사부, 공판부 소속의 비주류 검사로서 날마다 기록으로 만나고 공소장에는 다 담지 못한 이야기를 담았다. 인간에 대한 애정과 쉽게 판단하지 않고 쉽게 휘둘리지 않는 섬세함과 단단함이 돋보인다."
친애하는 나의 집에게,하재영,라이프 앤 페이지,2020,224,"문학, 200~300쪽, 에세이","집과 구성원과 계층, 기억에 대한 이야기.
 저자가 살아온 집 얘기를 통해 가족 안의 계층과 사회 계층에 대한 얘기를 풀어내고, 집에 얽힌 추억과 역사에 대한 얘기가 의미있고 재밌다"
친애하는 나의 집에게,하재영,라이프앤페이지,2020,224,"문학, 200~300쪽, 에세이","집과 구성원과 계층, 기억에 대한 이야기. 저자가 살아온 집 얘기를 통해 가족 안의 계층과 사회 계층에 대한 얘기를 풀어내고, 집에 얽힌 추억과 역사에 대한 얘기가 의미있고 재밌다"
친절하게 웃어주면 결혼까지 생각하는 남자들,박정훈,내인생의 책,2019,328,"인문사회, 300쪽 이상, 에세이",남자가 보는 남자들의 솔직한 자기 반성이 담긴 에세이. 남녀가 싸우지 않고 공존하려면 어떻게 해야할지 생각해볼 수 있다.
친절한 존(국립존엄보장센터),김이환,서해문집,2022,,"문학, 200~300쪽, 소설",인공지능 존과 완벽하게 조화로운 삶을 사는 주인공. 존이 없는 삶은 상상할 수 없다. 존에 길들여지고 의존하는 삶 속에서 평온함과 안정을 느낀다. 그러나 독자는 주인공을 비롯한 사람들이 이미 인공지능에 지배당하고 있다는 느낌을 지울 수 없다.
침팬지와의 대화,로저 파우츠,열린책들,2017,528,"문학, 300쪽 이상, 에세이","침팬지의 수화 습득과정 관찰을 통해 말의 형태에 대한 고정관념, 다른 종에 비해 우월하다 여기는 인간의 가치, 동물생체실험문제 등을 고민하게 하는 글이다. 더불어 침팬지와 사육사의 사귐이 재미와 감동을 준다."
카메라 편견을 부탁해,강윤중,서해문집,2015,328,"인문사회, 300쪽 이상, 시",우리 사회에서 차별과 편견이 되어온 대상들을 다시 생각하게 하는 책. 생생한 현장의 사진과 함께 묵직한 글이 실려 있다.
카메라(안녕 주정뱅이),권여선,창비,2016,,"문학, 200~300쪽, 소설","누군가에게는 연인에게 줄 소중한 선물인 카메라가, 불법체류자들에게는 위험으로 인식된다. 한 남자의 죽음은 무엇 때문일까 고민하게 된다."
카메라를 끄고 씁니다,양영희,마음산책,2022,216,"인문사회, 200~300쪽, 에세이","영화 3부작 <디어 평양>, <굿바이 평양>, <수프와 이데올로기>의 탄생 과정에 대한 양영희 감독의 에세이. 일제 강점기와 한국 전쟁, 재일 조선인과 제주 4.3 사건과 얽힌 우리 민족의 복잡한 역사를 영화와 함께 풀어낸다."
"카페, 공장",이진,자음과 모음,2020,216,"문학, 200~300쪽, 소설","여고생 4명이 부모님 모르게마을의 빈공장에 카페를 차림. 커피 드립, 제빵, 인테리어, 회계 등 각각 임무를 맡아서 열심히 일을 하다가 sns맛집이 되어 더 많은 손님이 찾아옴. 일하는 기쁨이 잘 드러난 소설."
"카페, 공장",이진,자음과모음,2020,216,"문학, 200~300쪽, 소설","여고생 네 명이 동네 있는 버려진 공장을 카페로 꾸며서 몰래 영업하는 이야기이다. 원두커피 만들기, 디저트 만들기, 소품 꾸미기, 수입과 지출 맞추기 등 노동 이야기가 사실적으로 나와있고, 진상손님, 부모님에게 도서관간다고 거짓말한 이야기, 공장 주인의 출현 등 여러 사건이 끊이지 않아 재미있게 읽을 수 있다."
캔버스를 찢고 나온 여자들,이유리,한겨레출판,2020,296,"예술·문화, 200~300쪽, 교양","남성 캔버스에 가려졌던 여성들, 그리고 여성 예술가의 이야기. 여성의 고통을 예술로 둔갑시킨 시대에 대한 폭로를 통해 그림 속 여성들을 만날 수 있다. 표지 속 단호한 시선의 여성의 이야기가 궁금하다면."
코뿔소 모자 씌우기,임수현,창비,2023,118,"문학, 200쪽 이하, 시","아이들에게도 슬픔이 있고 동시에도 깊이가 있다. 가볍게 읽고, 깊이 생각해 볼 수 있는 시집이라 동시 읽고 질문하기 활동을 해 보면 좋을 것 같다. 여러 지점에서 어린 나의 슬픔이 떠오르는 동시집."
"콜센터 상담원, 주운씨",박주운,애플북스,2020,224,"문학, 200~300쪽, 에세이","공연티켓을 판매하며 주6일, 하루 70통, 한 달에 1500통의 전화를 받아야 하는 콜센터 상담원의 일상을 그렸다. 5년 간 감정노동자로서 진상 고객의 민원과 모욕을 받아냈던 쓰라린 시간을 읽다보면 부끄럽고 미안해진다."
크게 그린 사람,은유,한겨레출판,2022,304,"인문사회, 300쪽 이상, 교양","세상에 지지 않고, 고통에 쪼그라들지 않고 크게 살아가는 18인을 인터뷰한 책, 각자 하는 일과 상황은 다르지만 공통점은 사람에게 상처받고 실망한 이들에게 희망을 주고, 어떻게 살아갈지 고민하게 만드는 사람들이다."
크게 그린 사람,은유,한겨레 출판,2022,304,"인문사회, 300쪽 이상, 교양","세상에 지지 않고, 고통에 쪼그라들지 않고 크게 살아가는 18인을 인터뷰한 책, 각자 하는 일과 상황은 다르지만 공통점은 사람에게 상처받고 실망한 이들에게 희망을 주고, 어떻게 살아갈지 고민하게 만드는 사람들이다."
킁킁 가게,김윤화,샘터사,2018,44,"기타, 200쪽 이하, 교양",가정폭력으로 엄마와 헤어지게 된 아이가 냄새를 파는 가게에서 만난 아이를 잃어버린 아줌마와 친하게 되면서 상실을 극복하는 이야기
키 다른 나무들이 숲을 이루고,강미,앤드,2024,224,"문학, 200~300쪽, 소설","학교 폭력 피해자인 현과 가정 폭력의 피해자이자 학교 폭력 가해자인 민철, 도촬이 개인의 취향이라고 믿는 모범생 진목. 이들이 555 나나숲 프로젝트에서 여러 멘토를 만나면서 성장해 나간다. 누군가의 성장을 지켜보며 응원한다는 것은 결국 응원받는 사람뿐만 아니라 응원하는 사람까지도 함께 성장하는 과정임을 느낄 수 있다."
"킬트, 그리고 퀼트",주민현,문학동네,2020,148,"문학, 200쪽 이하, 시","이 시대를 살아가는 청년, 혹은 여성으로서 느끼는 불편한 감정을 드러낸 시가 더러 있다. 그외에는 신선하고 경쾌한 시도 많아 학생들과 읽기 좋다."
킹과 잠자리,케이슨 캘린더,사계절,2023,276,"문학, 200~300쪽, 소설",2020년 전미도서상 청소년 책 수상작. 킹이라는 소년이 샌디라는 친구와의 관계 속에서 자신을 찾아간다. 사랑하는 사람의 죽음을 겪은 사람들이 어떻게 슬픔을 치유해 가는가 질문을 던진다. 차별과 혐오에 대한 이야기.
타인은 놀이공원이다,지승호,싱긋,2019,236,"인문사회, 200~300쪽, 교양",부조리한 사회와 권력 앞에 맞서 소신을 지키며 살아온 사람들의 이야기다. 스스로 진지하고 깊은 생각을 할 수 있는 기회가 된다. 조금 묵직해서 학생들이 심각하게 읽기는 하지만 의미 있게 다가오는 문장 앞에서 옳은 삶이 무엇인지 고민한다.
타인을 듣는 시간,김현우,반비,2021,232,"문학, 200~300쪽, 에세이",연대'는 타인을 이해한 후에야 가능한 것이 아니라 그들을 인정할 때 가능하다고 말하는 작가는 다큐멘터리 피디이다. 그의 글을 읽다보면 그의 카메라 앞에서 타인은 온전히 한 사람으로서 받아들여지고 있었을 거라는 생각이 든다. 독서에세이지만 글 속에 언급되는 책들을 못 읽었다고 해서 독서를 방해하지는 않는다. 오히려 그 책을 만나보고 싶은 마음이 든다.
타인의 고통에 응답하는 공부,김승섭,동아시아,2023,320,"인문사회, 300쪽 이상, 교양","존재하지만 눈에 띄지 않는 날이 많아 자주 잊는, 잊히는 사회적 약자에 대한 다양한 면을 공부하듯 꼼꼼하게 담아낸 책이다. 각 챕터 안에는 사회적 맥락에 따른 약자의 상황과 인터뷰, 통계 자료 등을 모으며 공부한 김승섭의 시간이 녹아 있다."
타인의 고통에 응답하는 공부,김승섭,동아시아,2023,320,"인문사회, 300쪽 이상, 교양","존재하지만 눈에 띄지 않는 날이 많아 자주 잊는, 잊히는 사회적 약자에 대한 다양한 면을 공부하듯 꼼꼼하게 담아낸 책이다. 각 챕터 안에는 사회적 맥락에 따른 약자의 상황과 인터뷰, 통계 자료 등을 모으며 공부한 김승섭의 시간이 녹아 있다."
타인의 집(타인의 집),손원평,창비,2021,,"문학, 200~300쪽, 소설","아파트 세입자인 쾌조 씨는 매일 주식 차트를 들여다보며 최소한의 소비로 살아간다. '나'와 재화 언니, 희진은 집주인이 아닌 쾌조 씨에게 불법으로 월세를 내며 함께 지낸다. 갑자기 집주인이 아파트를 팔게 되면서 다시 방을 알아봐야 하는 처지에 놓이게 된다. 집을 둘러싼 사람들의 욕망이 뒤얽히며, 집이란 어떤 공간이어야 하는지를 묻는다."
타임슬립 2119-한국사 복원 프로젝트,임어진 외,사계절,2020,,"문학, 200~300쪽, 소설","역사적 유물의 정체를 확인하기 위하여 타임슬립을 하여일제강점기로 학생들이 날아간다. 조선인 여자 비행사,할머니 독립운동가 등 역사 속에서 잘 알려지지 않은 인물들을 만날 수 있고, 영화 한 장면처럼 잘 그려지는 소설. 역사 덕후를 저격하는 책."
탄광 마을 아이들,임길택,실천문학,2004,142,"문학, 200쪽 이하, 시","14년 동안 강원도 탄광 마을과 산골 마을에서 아이들을 가르친 선생님이 쓴 시집. 쉬운 말로 쓰였지만, 시에 담긴 삶의 고단함과 아픔에 눈물짓게 됨."
탈북자,조천현,보리,2021,328,"인문사회, 300쪽 이상, 교양",한국에 와서 살아가는 탈북자들의 솔직한 목소리가 담겨 있다.
탈코르셋: 도래한 상상,이민경,한겨례,2019,396,"인문사회, 300쪽 이상, 교양","꾸밈을 거부하고 자유로운 주체가 되고자 하는 여성들이 겪은 각성과 노력, 억압과 좌절, 희망과 연대를 생생하게 담은 인터뷰집."
탐페레 공항(일의 기쁨과 슬픔),장류진,창비교육,2022,,"문학, 200~300쪽, 소설",여행길에 생긴 우연한 만남에서 비롯된 이야기가 감동적으로 펼쳐진다. 아주 작고 사소한 다정함이 얼마나 거대한 힘을 가졌는지 느껴볼 수 있는 작품. 작품을 읽으면 '내 삶에서 진짜 중요한 것은 무엇인가? 나는 중요한 것을 중요하게 여기며 사는가?'라는 질문을 자연스럽게 나눌 수 있음.
태도가 작품이 될 때,박보나,바다출판사,2019,148,"예술·문화, 200쪽 이하, 에세이",동시대 현대미술가들의 작품을 소개하면서 지금-우리에게 던지는 질문들을 에세이 형식으로 풀어간 책. 미술이 미술관에만 존재하는 것이 아니라 우리 삶과 밀접한 관련이 있음을 보여주고 있다.
태양으로 날아간 화살,제럴드 맥더멋,시공주니어,2017,16,"기타, 200쪽 이하, 교양","주몽이야기를 떠올리게 하는 이야기. 고대 설화를 아름다운 그림으로 담아낸 작품으로, 아이들과 다양한 이야기를 나눌 수 있을 듯 하다. 가족 안에서 아버지는 어떤 존재인지 생각해보게 한다."
태어난 아이,사노 요코,거북이북스,2016,32,"기타, 200쪽 이하, 교양",태어나기 싫어서 태어나지 않은 아이가 다쳐서 엄마에게 위로 받고 치료 받는 아이를 보고 태어나기로 결심한다. 산다는 건 무엇인가 깊게 생각해볼 수 있다.
태초의 선함에 따르면 (소설 보다 가을 2020),우다영,문학과 지성사,2020,,"문학, 200~300쪽, 소설",식물의 독에 의한 감염과 전염으로 각성된 사람들이 나타나고 이들은 전생의 무수한 삶을 다 기억하게 된다. 전생에 자신들의 원수나 은인을 현생에서 다시 만난다면 어떻게 행동하게 될까. 무수한 생 속에서 `나`는 어떤 모습으로 반복될까. 환타지적 상상력의 재미와 삶의 의미에 대한 질문을 받게 된다.
터널,헤게 시리,책빛,2018,40,"기타, 200쪽 이하, 교양",서로 사랑하는 토끼 둘이 도로 건너편으로 가기 위해 터널을 파는 이야기로 자연의 아름다움과 로드킬 당한 동물의 모습이 함께 등장해 그 비참함이 더해진다. 그림체가 예술적이다.
톡톡톡,공지희,자음과모음,2015,296,"문학, 200~300쪽, 소설","이성 교제, 청소년 임신, 성에 관한 이야기. 생명의 소중함을 깨달을 수 있다."
톡톡톡,공지희,자음과모음,2015,296,"문학, 200~300쪽, 소설","낙태, 판타지를 다룬 소설. 『키싱 마이 라이프』보다 문학적 완성도가 높음."
퇴근길엔 카프카를,의외의사실,민음사,2018,416,"기타, 300쪽 이상, 만화",만화로 읽는 세계 문학 에세이.
트라이앵글의 심리,이보경,양철북,2018,260,"인문사회, 200~300쪽, 교양",초등학생 학교폭력의 심리를 세밀하게 분석하고 있다.
트리니티-신의 불을 훔친 인류 최초의 핵 실험,조너선 페터봄,서해문집,2013,160,"과학, 200쪽 이하, 교양","영화 '오펜하이머'로 더 유명해진 핵무기 개발 프로젝트. 인류가 핵무기를 만들게 된 과정을 역사적, 물리학적 관점으로 설명한 그래픽 노블"
트릭 미러,지아 톨렌티노,생각의힘,2021,460,"인문사회, 300쪽 이상, 에세이",미디어를 통해 왜곡되는 여성들의 모습에 대해 솔직하게 쓴 에세이. 토론 거리가 많으나 번역투 때문에 어느 정도 이상의 독해력이 있는 학생들에게 추천
특별한 호두,서동찬,자음과모음,2023,292,"문학, 200~300쪽, 소설","열 네살 남학생 호두에게는 엄마가 없다. 작은 아빠, 큰 아빠 두 아빠만 있을 뿐. 과연 누가 진짜 아빠일지, 궁금한 마음으로 읽기 시작해서 결국은 이런 삶도 있구나, 다양한 관계와 성장을 담담히 받아들이게 된다."
특별한 호두,서동찬,자음과모음,2023,292,"문학, 200~300쪽, 소설","열 네살 남학생 호두에게는 엄마가 없다. 작은 아빠, 큰 아빠 두 아빠만 있을 뿐. 과연 누가 진짜 아빠일지, 궁금한 마음으로 읽기 시작해서 결국은 이런 삶도 있구나 담담히 받아들이게 된다."
틈만 나면,이순옥,길벗어린이,2023,60,"기타, 200쪽 이하, 교양",작은 틈이 있는 곳에 어디서든 싹을 틔우는 식물이 있다. 씩씩하게 싹을 틔우고 쑥쑥 자라 담을 넘는 꿋꿋한 모습이 용기와 감동을 주고 여백이 많은 서정적인 삽화가 편안함과 여유를 준다. 자기 내면과 만날 수 있게 한다.
파도가 바다의 일이라면,김연수,문학동네,2015,288,"문학, 200~300쪽, 소설",입양소녀가 자신의 친모를 찾는 과정에서 드러나는 아픔을 다룬 이야기. 가로막힌 진실 앞에서 혼란스러워하는 주인공의 선택은 독자를 생각에 잠기게 한다. 문장이 참 아름다운 소설.
파란 집의 수상한 이웃들,오사 린드,책읽는곰,2013,192,"기타, 200쪽 이하, 교양",콜럼버스에 관한 글짓기 숙제를 못한 엘리카에게 팜파스 아저씨가 파란 아파트를 탐험해 보라는 제안을 한다. 엘리카는 `발견 수업`을 들고 파란집에 사는 사람들을 탐험한다.
파란만장 내 인생,구경미,문학과지성사,2016,200,"문학, 200쪽 이하, 소설","열다섯 소녀들의 성장 이야기. 웃음과 재미, 공감을 보장한다."
파란하늘 빨간지구,조천호,동아시아,2019,292,"기타, 200~300쪽, 교양",대기과학자가 기후변화와 관련된 여러 사안을 알기 쉽게 설명하고 있다.
판사유감,문유석,21세기북스,2019,316,"인문사회, 300쪽 이상, 교양","<개인주의자 선언>, <미스 함무라비>를 쓴 현직 부장판사 문유석의 책이다. 그가 말하는 법과 정의, 우리 사회와 사법부의 문제 등에 대해 이야기한다."
판타스틱 우울백서,서귤,이후진프레스,2019,208,"문학, 200~300쪽, 만화",작가가 경험한 정신과 치료 일기. 우울할 때조차 '나는 우울할 자격이 있을까' 묻게 된다. 정신과 치료를 주변에 말할지 말지 고민한다. '정신병자 아니야'란 인터넷 댓글에 상처 받는다. 서귤이 우울증으로 정신과 치료를 받아온 경험을 담백하게 그려낸 만화.
팝콘교실,문현식,창비,2015,116,"문학, 200쪽 이하, 시",어린이들의 모습이 생생하게 드러나는 동시집. 따뜻하고 유쾌하다.
팥빙수의 전설,이지은,웅진주니어,2019,56,"기타, 200쪽 이하, 교양",<해와 달이 된 오누이>에서 영감을 얻어 창작한 책으로 위기를 재치있게 극복한 할머니의 용기가 즐거움을 준다.
팩트체크,JTBC 뉴스룸 팩트체크제작팀,중앙북스,2015,378,"인문사회, 300쪽 이상, 교양","무심코 지나치지만 우리의 일상과 생계와 직결돼 있는 중요한 정보에 대해 제대로 판단하고, 평가할 수 있다."
팩트풀니스,한스 로슬링외 2인,김영사,2019,474,"인문사회, 300쪽 이상, 교양",인간의 비합리적 본능을 구체적 수치를 예로 들어 통렬하게 비판한다. 특히 책 초반에 실린 세계를 소개하기 위한 13가지 질문에서 침팬지를 이기기란 너무 어렵다. 우리의 잘못된 확증 편향을 되돌아볼 수 있는 기회
팬티 바르게 개는 법,미나미노 다다하루 지음,공명,2014,252,"인문사회, 200~300쪽, 교양","일본의 기술가정교사인 저자가 청소년이 인생을 살아갈 때 꼭 필요한 '4대 자립(생활적, 경제적, 정신적,성性적 자립)'과 '생활력'을 알려준다. 읽고 나서 실천할 것들을 찾아보자."
