title,author,publisher,year,pages,tags,description
"댄스, 푸른 푸른",김선우,창비교육,2018,116,"문학, 200쪽 이하, 시",(창비청소년시선은 기성 시인들이 청소년 독자를 대상으로 쓴 시집이다. 최근까지도 연이어 출간되고 있으니 시집 목록 꾸릴 때 참고하면 좋다. 수준은 대체로 중1부터 읽을 수 있는 정도로 쉽고 재미있다.) 씩씩한 소녀 화자가 등장하는 시집. 제목처럼 싱그럽다.
댓글부대,장강명,은행나무,2015,248,"문학, 200~300쪽, 소설",돈 받고 댓글 조작하는 사람들 이야기를 다룬 책. 사회의 한 면이기에 알아야 당하지 않는다. 역겨운 장면이 나오니까 그게 싫은 사람은 이 책을 집어들면 안 된다.
더 맞춤법,김남미,태학사,2020,328,"인문사회, 300쪽 이상, 교양","쏟아지는 맞춤법 도서 가운데 단연 눈에 띄는 맞춤법 책. 맥락 없이 맞춤법을 소개하는 책이나, 맞춤법 규정에 따라 소개하는 책과는 질적으로 다르다. 사람들이 자주 틀리는 맞춤법 사례들을 그 원인에 따라 분류하여 맞춤법에 접근하기 쉽도록 설계한 책이어서 매우 체계적이다."
더 인간적인 말 (2018 제9회 젊은작가상 수상작품집),정영수,문학동네,2018,,"문학, 200~300쪽, 소설",죽음을 선택하려는 이모와 그 선택에 딴지를 걸고자 하였으나 결국 승복할 수밖에 없었던 조카의 이야기.
더 크게 소리쳐! : 세상을 바꾸려는 십대들의 명연설문,아도라 스비탁,특별한 서재,2021,320,"인문사회, 300쪽 이상, 교양","연설 문화가 부족한 한국 사회에서 연설을 가르치기가 쉽지 않다. 세상을 바꾸려는 10대들의 명연설문은 연설의 설득전략을 배울 수 있으며, 청소년들이 직접 한 연설을 모은 책이라는 점에서 아이들에게 용기를 북돋아준다."
더러운 나의 불행 너에게 덜어줄게,마르탱 파주,내인생의책,2013,112,"문학, 200쪽 이하, 소설",자칭 '부적응자 클럽' 회원들이 겪는 특별한 시행착오. '불행을 평등하게 나누는 기계'로 행복할 수 있을까? 남이 아닌 나를 기준으로 하는 행복이 무엇인지 생각해보게 해주는 소설. 쉽고 잘 읽힌다.
덕다이브,이현석,창비,2022,300,"문학, 200~300쪽, 소설",300쪽이지만 판형이 작고 글씨가 커서 그리 긴 분량은 아니다. 한때 병원에서 같이 일했던 간호사들이 우연한 기회에 만나면서 벌어지는 이야기를 다뤘다. 의료계의 태움 문화나 SNS 인플루언서 댓글 문제와 같이 현대사회의 문제들을 소설 속에 잘 그려내어 흡입력 있고 토론 거리가 많다.
덕혜옹주 : 조선의 마지막 황녀,권비영,다산책방,2015,360,"인문사회, 300쪽 이상, 소설",두께가 좀 되지만 영화로도 나왔기 때문에 아이들이 감정이입해서 잘 읽는 편이다.
"덜미, 완전범죄는 없다 1",한국일보경찰팀,북콤마,2018,340,"과학, 300쪽 이상, 교양","완전범죄를 노리는 범죄자들과 이를 쫓는 형사들의 치열한 싸움, 이 책을 읽다보면 수사관들의 집요함과 치밀함에 존경이, 한편으론 과학수사 기법의 중요성을 알게 된다."
"덜미, 완전범죄는 없다1",한국일보경찰팀,북콤마,2018,340,"과학, 300쪽 이상, 교양","완전범죄를 노리는 범죄자들과 이를 쫓는 형사들의 치열한 싸움, 이 책을 읽다보면 수사관들의 집요함과 치밀함에 존경이, 한편으론 과학수사 기법의 중요성을 알게 된다."
"덜미, 완전범죄는 없다1",한국일보 경찰팀,북콤마,2018,340,"인문사회, 300쪽 이상, 교양","완전범죄를 노리는 범죄자들과 이를 쫓는 형사들의 치열한 싸움, 이 책을 읽다보면 수사관들의 집요함과 치밀함에 존경이, 한편으론 과학수사 기법의 중요성을 알게 된다."
데스타이머,전성현,사계절,2022,160,"문학, 200쪽 이하, 소설",<데스 타이머>는 사망까지 남은 시간을 알려주는 어플리케이션 '데스타이머'가 등장한 이후의 세계를 그린다. 데스타이머가 만들어지자 사람들은 타인과 환경을 자신의 수명을 갉아먹는 위협 요소로 인식하게 된다. 갑자기 많은 사람들의 데스타이머의 숫자가 일시에 줄어드는 사건이 벌어지는데! 데스타이머의 숫자가 줄어든 후 사람들은 어떻게 달라질까? 데스 타이머가 갑자기 변화한 이유는 무엇일까?
데스타이머(데스타이머),전성현,사계절,2022,,"문학, 200~300쪽, 소설","나의 사망까지 남은 시간을 알려주는 어플리케이션 '데스타이머'가 등장한 이후의 세계를 그린다. 데스타이머가 만들어지자 사람들은 타인, 환경을 자신의 수명을 갉아먹을 수 있는 위협 요소로 인식하게 된다. 갑자기 많은 사람들의 데스타이머의 숫자가 일시에 줄어드는 사건이 벌어지는데! 데스타이머의 숫자가 줄어든 후 사람들은 어떻게 달라질까? 데스 타이머가 갑자기 변화한 이유는 무엇일까?"
"데이빗 1,2",d몬,푸른숲,2021,228,"기타, 200~300쪽, 만화",다름에 대해 혐오로 반응하는 세상의 문제를 비롯해 동물권에 대한 이야기를 몰입감 있고 재밌게 풀어낸다. 영화 옥자가 재밌는 웹툰이 된다면 데이빗이지 않을까.
데이빗 1~2,d몬,푸른숲,2021,228,"기타, 200~300쪽, 만화",다름에 대해 혐오로 반응하는 세상의 문제를 비롯해 동물권에 대한 이야기를 몰입감 있고 재밌게 풀어낸다. 영화 옥자가 재밌는 웹툰이 된다면 데이빗이지 않을까.
도넛경제학,케이트 레이워스,학고재,2018,416,"인문사회, 300쪽 이상, 교양",경제 초보도 너끈히 읽을 수 있도록 그림과 비유로 쉽게 설명한다. 경제와 환경 문제가 얼마나 긴밀하게 연결되어 있는지 설득력 있게 전하는 책.
도둑맞은 집중력,요한 하리,어크로스,2023,464,"인문사회, 300쪽 이상, 교양",요즘 사람들이 집중력이 떨어지는 이유를 개인에게서 찾지 않고 사회 구조에서 찾아 엄밀하게 밝혀내는 책. 책이 잘 읽히면서도 현대사회의 여러가지 문제들을 직면하게 한다. 문해력에 대해 다각도로 생각할 수 있는 책이다.
도둑맞은 집중력,요한 하리,어크로스,2023,464,"인문사회, 300쪽 이상, 교양",아침에 일어나자마자 웹서핑으로 하루를 시작하는 우리들. 왜 점점 우리는 화면 안에 빠져드는 것일까? 우리 사회에 만연한 집중력 저하에 대해 거시적으로 성찰한 요한 하리의 이야기
도시 악어,"글라인, 이화진",요요,2022,40,"문학, 200쪽 이하, 에세이",도시에 사는 악어가 소수자로 느끼는 외로움의 시간을 겪은 후 자신을 수용하고 스스로의 방식대로 살게 되는 과정을 감동적으로 그렸다.
도시악어,"글 이화진
 그림 루리",요요,2022,40,"기타, 200쪽 이하, 교양",우연히 도시에서 살게 된 악어가 있는 그대로의 자기를 받아들이는 과정이 흥미진진하다. 삽화가 멋지고 악어의 표정과 행동이 재미있다. 인간을 한 발 뒤에서 지켜볼 수 있다.
도시에서 죽는다는 것,김형숙,뜨인돌,2017,304,"인문사회, 300쪽 이상, 교양",국내 대형 병원의 중환자실 간호사로 20년 가까이 일한 저자는 중환자실에서 죽음을 눈앞에 둔 사람들의 다양한 사연을 모아 글로 썼다.
도시에서 죽는다는 것,김형숙,뜨인돌,2017,304,"문학, 300쪽 이상, 에세이",종합병원 중환자실 간호사로 일했던 작가가 경험한 삶과 죽음의 이야기. 어떻게 하면 인간다운 죽음을 준비하고 맞이할 수 있을까 질문을 던진다.
도움받는 기분,백은선,문학과지성사,2021,272,"문학, 200~300쪽, 시",아픈 적이 있던 사람이라면 가슴에 꽂히는 구절을 많이 만날 수 있다.
도움의 손길(일의 기쁨과 슬픔),장류진,창비,2020,,"문학, 200~300쪽, 소설","청소 도우미 아주머니와 그를 고용한 집주인 사이의 미묘한 갈등을 그리고 있다. 두 인물 중 누구의 편을 들어야 할 지 알 수 없는 애매한 상황 속에서 변화하는 노동의 모습이나 1:1 계약 관계, 자본주의 속의 인간관계를 생각할 기회를 마련해 준다."
독고솜에게 반하면,허진희,문학동네,2020,232,"문학, 200~300쪽, 소설","전학생 독고솜, 여왕벌 단태희, 그 뒤를 따르는 박선희, 자칭 명탐정 서율무, 힘의 서열이 존재하는 교실 공간에서 타자에 대한 편견을 깨뜨리게 하는 주제의식이 미스터리와 환상적인 기법으로 잘 버무려진다."
독고솜에게 반하면,허진희,문학동네,2020,232,"문학, 200~300쪽, 소설","전학생 독고솜, 여왕벌 단태희, 그 뒤를 따르는 박선희, 자칭 명탐정 서율무, 힘의 서열이 존재하는 교실 공간에서 타자에 대한 편견을 깨뜨리게 하는 주제의식이 미스터리와 환상적인 기법으로 잘 버무려진다."
독서동아리 100개면 학교가 바뀐다,"서현숙, 허보영",학교도서관저널,2019,264,"인문사회, 200~300쪽, 교양","부제는 '함께 읽고 토론한 홍천여고 3년의 기록', 독서토론수업, 독서동아리 활동, 학교 독서프로그램과 연계하여 학생들에게 독서문화가 어떻게 전파되었는지 알 수 있다. 현장교사가 실천한 독서토론의 다양한 활동 사례를 생생하게 보고, 배울 수 있다."
돈이 먼저 움직인다,제현주,어크로스,2021,272,"인문사회, 200~300쪽, 교양","투자로 버는 돈은 어디서 왔을까? 북극곰이랑 투자가 무슨 상관일까? 가치관을 지키면서 주식에 투자할 방법은 없을까? 이런 게 있다는 걸 우린 왜 몰랐을까? 투자에도 가치관을 반영할 수 있다는 걸 설명해주는 매력적인 경제 책. 임팩트 투자, ESG 등의 용어에 익숙해질 시간은 필요하다."
돌담(겨울방학),최진영,민음사,2019,,"문학, 200~300쪽, 소설","낡은 버스의 폭발 사고로 딸을 잃은 부모가 긴 칩거 끝에 돌담을 쌓기 시작한다. 환경 호르몬 유발 제품을 판매하는 회사를 내부고발한 '나'는 추운 겨울 돌을 찾으며 길을 나선다. 애도와 추모, 저항과 의지의 돌 쌓기에 대한 이야기. 다양한 토론 질문들을 만들어 낼 수 있다."
동물에 대한 예의가 필요해,박현주,책공장더불어,2021,192,"문학, 200쪽 이하, 에세이","부제는 '냅킨에 쓱쓱 그린 동물을 대하는 인간의 태도에 대하여' 책 읽기 싫어하는 학생도 쉽게 읽고 동물권을 생각할 수 있도록, 동물에게 마이크를 주어 절실한 목소리를 들어 본다."
동물에게 다정한 법,동변,날,2022,200,"인문사회, 200쪽 이하, 교양","동물의 권리를 옹호하는 변호사들이 동물보호법과 관련된 재판을 한 경험을 책으로 엮은 것. 산천어 축제, 꽃마차 말처럼 우리 일상에서 흔히 일어나는 동물학대이지만 모르고 지나가는 문제들, 수족관에 갖힌 돌고래, 안락사 당하는 동물 등 고민해 볼 만한 동물 문제를 다루고 있음."
동물원에 동물이 없다면,노정래,다른,2019,200,"인문사회, 200쪽 이하, 교양","동물원의 역사, 동물 복지 의식 확대에 따른 동물원의 변화, 동물원과 관련된 직업, 동물원에서 일하기 위해 해야 하는 공부를 총체적으로 제시한 책. 동물 관련 진로를 희망하는 학생들에게 추천하면 좋은 책."
동물원에서 만난 세계사,손주현,라임,2019,240,"과학, 200~300쪽, 에세이",역사의 흐름에 따라 동물과 인간의 관계를 되짚어 본다. 특히 최근 동물권이나 동물 복지 등에 대한 이야기는 인류의 미래와도 직결되는 과제로 흥미롭게 읽힌다.
동물은 어떻게 슬퍼하는가,바버라 J.킹,서해문집,2022,348,"문학, 300쪽 이상, 에세이",사별한 동물들의 애도 방식을 보여주는 책. 그들이 보이는 행동이 신기한 것이 아니라 아름답고 고귀한 것임을 깨닫게 해준다.
동물을 사랑하면 철학자가 된다,이원영,문학과지성사,2017,196,"문학, 200쪽 이하, 에세이","만남부터 이별까지, 반려동물과 함께한다는 것에 대해 철학과 출신 수의사가 쓴 에세이."
동사의 맛,김정선,유유,2015,302,"인문사회, 300쪽 이상, 교양",한국어의 어려움은 대부분 동사에서 온다. 용언의 활용이 여러 번에 걸쳐 일어나기 때문에 점 하나로 의미가 바뀐다. 동사를 활용하는 법과 함께 동사의 차이를 보여주면서 한국어의 맛을 다채롭게 느끼도록 도와주는 책이다. 언어에 관심있는 아이들은 흥미롭게 읽으나 난이도가 있는 편.
동시를 읽는 마음,김재곤,창비,2022,400,"인문사회, 300쪽 이상, 시",동시의 과거와 현재를 아우르는 동시 평론집. 지금까지 잘 몰랐던 동시에 입문하기 좋다.
동자동 사람들,정택진,빨간소금,2021,284,"인문사회, 200~300쪽, 교양",쪽방촌 사람들이 어떻게 살아가는지 매우 세밀하게 이야기하고 있다.
"두 번째 달, 블루문",신운선,창비,2017,244,"문학, 200~300쪽, 소설",힘든 가정 환경에서 자라온 여주인공이 임신을 하고 미혼모센터에서 출산하게 되는 이야기. '키싱 마이 라이프'와 비슷한 소재로 여학생들이 선호할 것 같음.
두 번째 페미니스트,서한영교,아르테,2021,312,"문학, 300쪽 이상, 에세이","어느 날 자신이 너무도 남성 중심적인 사회에서 살고 있음을 결혼과 육아를 통해 깨닫고 조금씩 변화하려는 남편이자 아버지, 그리고 한 시민의 이야기이다. 살림과 일상을 돌보면서 깨달은 사실을 페미니즘이라는 이름으로 우리에게 전해준다."
두려움은 소문일 뿐이다,최현숙,문학동네,2023,356,"인문사회, 300쪽 이상, 교양",구술생애사 작가인 최현숙의 솔직한 회고록. 도벽과 액취증으로 아픔을 겪던 젊은 시절을 통과해 소외된 이들과 함께 살아가게 된 그의 삶을 들여다볼 수 있다. 여럿이 함께 읽으면 개인적 공감부터 사회적 문제까지 다채로운 이야기를 나눌 수 있다.
두번째 지구는 없다,타일러 러쉬,알에이치코리아,2020,208,"문학, 200~300쪽, 에세이","비정상 회담으로 잘 알려진 타일러가 쓴 책. 기후 위기의 심각성을 일깨워주고, 어떻게 하면 지구에게 덜 미안한 방식으로 살아갈 수 있는지 대안을 제시한다. 아이들과 환경 문제의 심각성과 실천 방안에 대해 이야기 나누기 좋다. 아주 쉽다! 중학생도 읽을 수 있는 책이다. 정말 추천."
드라이,"닐 셔스터먼,
 재러드 셔스터먼",창비,2019,460,"문학, 300쪽 이상, 소설",어느 날 갑자기 물이 나오지 않는다. 부모님은 물을 구하러 가서 돌아오지 않고 사람들은 점점 워터좀비가 된다. 얼리샤는 옆집 켈텐의 도움을 받아 동생과 함께 이 재난 상황에서 살아남기 위해 고군분투한다.
"들꽃, 공단에 피다",아사히 비정규직지회,한티재,2017,300,"인문사회, 200~300쪽, 교양","구미공단 최초의 비정규직 노동조합이 싸워온 2년 간의 기록. 한국사회가 노동을 대하는 태도를 엿볼 수 있으며, 더 나은 미래를 위해 착한 사람들의 연대가 필요함을 말해주는 책."
디디의 우산,황정은,창비,2019,348,"문학, 300쪽 이상, 소설","촛불 혁명이 일어나던 시기의 한국 사회를 배경으로 한 중편 소설 두 편이 실려 있다. [디디의 우산]은 사랑하는 사람을 잃은 남자가 세상 속으로 다시 발을 딛는 이야기, [아무것도 말할 필요가 없다]는 촛불혁명의 복잡한 결을 여성의 입장에서 다룬 이야기다."
디지털 네이티브 그들은 어떻게 배우는가,마크 프렌스키,사회평론아카데미,2019,360,"인문사회, 300쪽 이상, 시",학생들과 수업에서 파트너 관계를 맺고 있는가? '명사'가 아니라 '동사'를 가르치려 하고 있는가? 학생과 교사의 역할을 다시 한 번 진지하게 생각해 보게 한다. 매체 연구회 선생님 추천 도서.
"디지털 장의사, 잊(히)고 싶은 기억을 지웁니다",김호진,위즈덤하우스,2021,208,"인문사회, 200~300쪽, 시",디지털 세상에서 어쩌면 피해자 혹은 가해자가 될 수도 있는 우리 모두에게 작가가 들려주는 생생한 이야기들은 현실적인 도움을 주는 한편 지금 우리 사회에 반드시 필요한 경각심을 일깨워준다.
"디지털 장의사, 잊(히)고 싶은 기억을 지웁니다",김호진,위즈덤하우스,2021,208,"인문사회, 200~300쪽, 시",디지털 세상에서 어쩌면 피해자 혹은 가해자가 될 수도 있는 우리 모두에게 작가가 들려주는 생생한 이야기들은 현실적인 도움을 주는 한편 지금 우리 사회에 반드시 필요한 경각심을 일깨워준다.
딱 일 년만 놀겠습니다,이은재,나무를 심는 사람들,2019,256,"문학, 200~300쪽, 에세이","중3여학생이 일반 고등학교 대신 `갭이어`로 여행학교를 다닌 일년 간의 기록, 친구들이 공부할 때 한눈 판 것처럼 보이지만 세상을 살아갈 몸과 마음의 근육을 키우는 게 진짜 공부가 아닐까?"
딸에 대하여,김혜진,민음사,2017,216,"문학, 200~300쪽, 소설",전혀 다른 시대를 살고 있는 엄마와 딸 이야기. 소설에서는 가족의 시선을 통해 서로에 대한 ‘최선의 이해’를 말하고 있지만 실은 사회의 약한 고리를 들여다보는 이야기이기도 하다.
딸에게 들려주는 인종차별 이야기,타하르 벤 젤룬,롤러코스터,2020,264,"인문사회, 200~300쪽, 교양",프랑스 작가 타하르 벤 젤룬이 딸과 인종주의와 인종차별의 야만성에 대해 나눈 대화를 통해 인종차별주의가 왜 나쁜지 알려주고 있다.
딸이 조용히 무너져 있었다,김현아,창비,2023,304,"인문사회, 300쪽 이상, 교양","의사 부부의 둘째딸에게 찾아온 양극성 장애를 의사 엄마가 기록한 글. 자신의 딸에게 일어난 일과 더불어 역사적으로 양극성 장애를 앓은 유명인들의 이야기를 같이 썼다. 요즘 주변에서 흔히 접할 수 있는 조울증, 우울증에 대해 생각해 볼 수 있는 책."
땀 흘리는 글,송승훈 외 엮음,창비교육,2020,176,"문학, 200쪽 이하, 소설","간호사, 교사, 요리사, 소설가 등 다양한 직업에 종사하는 사람들이 삶의 현장을 생생하게 담아내었다. 알바생의 고충부터 퇴사를 고민하는 직장인까지 솔직한 이야기가 펼쳐진다."
땀 흘리는 소설,김혜진 외,창비,2019,272,"문학, 200~300쪽, 소설","노동 현장, 땀의 현장으로 진출할 학생들 혹은 사회 초년생들에게 추천하는 소설들을 모았다. 사회 곳곳에서 고군분투 중인 작품속 청춘들의 문제가 남일 같지 않다."
땀 흘리는 시,김선산 외 엮음,창비교육,2020,152,"문학, 200쪽 이하, 시","2000년대 이후에 쓰여진 시들 중에서 노동과 삶의 문제를 다룬 시들을 엮었다. 청소년 아르바이트, 비정규직 문제, 외국인 노동자 등 노동하며 살아가는 사람들의 다층적인 목소리를 시로 만날 수 있다."
땀 흘리는 시,김선산 외,창비교육,2020,152,"문학, 200쪽 이하, 시","일과 노동을 주제로 한 시선집. 일 하러 나서는 마음부터 노동의 현장, 노동 이후의 휴식까지. 노동의 다양한 면모를 다룬 시들을 엮었다."
땋은 머리,"글 정미진 
 그림 배현정",엣눈북스,2017,58,"기타, 200쪽 이하, 교양",할머니가 손녀의 머리를 땋아 주며 나누는 대화 속에 둘의 삶이 겹쳐 흐르며 할머니의 사랑이 느껴진다. 그림이 아름답고 할머니의 경상도 사투리가 정겹다.
떠나지 못하는 사람들,최인기,동녘,2014,216,"인문사회, 200~300쪽, 교양",부제는 '무엇이 그들을 도시의 유령으로 만드는가?'이다. 도시에 사는 가난한 사람들에 대한 기록으로 20년 넘게 빈민운동의 현장에서 싸워온 저자가 들려주는 생생한 이야기다.
"또리네 집 1,2",장차현실,보리,2022,496,"기타, 300쪽 이상, 만화","만화가 장차현실의 조금은 특별한 가족 이야기, 다큐영화 감독이자 살림꾼인 남편, 다운증후군 장애가 있는 딸, 늦둥이 막내와 함께 어려운 상황 속에서도 씩씩하고 당당하게 살아가는 이야기는 독자에게 위로와 용기를 준다."
똑같은 얼굴,조규미,사계절,2023,176,"문학, 200쪽 이하, 소설","편견에 가려진 청소년들의 미묘한 관계를 그려 낸 작품으로, 따돌림의 경계에 선 아이들을 예리하게 포착한 다섯 편의 이야기를 담아냈다. 책읽기가 익숙하지 않은 중학생이 흥미를 가질 만한 기괴한 이야기."
똑똑한 사람들의 멍청한 짓,최동석,21세기북스,2018,280,"인문사회, 200~300쪽, 교양","권한 위임이 얼마나 중요한지 이야기함. 학교와 학급, 모임 운영에 깊은 영감을 얻음."
똑똑한데 가끔 뭘 몰라,정원,미디어창비,2023,152,"기타, 200쪽 이하, 만화",이상한 어른들에게 속시원하게 일침을 던지는 어린이들을 보고 있자면 사랑스럽기 그지없다.
"똥두 1, 2",국무영,비룡소,2020,584,"기타, 300쪽 이상, 만화",이름이 동두희여서 별명이 똥두인 여중생. 외모와 이름과 가정환경 그 모든 것에 불만을 갖고 있는 두희는 어느 날 잘생긴 오빠 하늘에게 한눈에 반한다. 매일 웃고 다니는 변기동이란 남학생은 왜 자꾸 마주치게 되는지? 두희의 사랑과 우정이 아름답게 펼쳐진다. 자존감이 바닥을 치는 중학생들이 이 만화를 읽으면 구겨진 마음이 스르르 펴질 것이다.
"똥두 1,2",국무영,비룡소,2020,584,"기타, 300쪽 이상, 교양","청소년기의 우정과 사랑, 꿈에 대한 이야기를 경쾌하면서도 감동적으로 다루고 있다."
라면은 멋있다(소설의 첫만남1),공선옥,창비,2017,,"문학, 200~300쪽, 소설",여자 친구에게 생일 선물을 사 주기 위해 편의점에서 아르바이트를 하는 ‘민수’. 어려운 가정 형편에도 절망하거나 체념하지 않고 씩씩하게 살아가려 애쓰는 주인공들의 모습이 건강한 기운을 전한다. ‘돈이 많으면 행복할까?’에 대해 어떻게 생각하는지 토론을 할 수 있다.
라이프 인사이드,앤디 웨스트,어크로스,2022,440,"인문사회, 300쪽 이상, 교양",저자 앤디 웨스트가 감옥 안 재소자들을 상대로 철학 수업을 한 이야기를 엮은 책. 자유가 억압된 사람들에게 토론하는 자유의 의미가 새롭게 다가온다. 범죄자인 아버지와 형을 둔 저자의 불안한 마음 속에서도 계속 철학 수업을 해나가는 앤디의 마음을 응원하게 된다.
랩걸 Lab Girl,호프 자렌,알마,2017,412,"과학, 300쪽 이상, 교양","여성 과학자로서 쉽지만은 않았던 분투 과정을 담담하게 그렸다. 학자로서, 또 엄마로서의 삶과 사유를 풀어내면서 식물에 대한 애정을 표현했다. 나무를 통한 아름다운 인생 비유도 넘실거리는 아름다운 책."
러닝 하이,탁경은,자음과 모음,2021,204,"문학, 200~300쪽, 소설",자신의 자리를 찾지 못해 고민하는 두 소녀가 달리기를 통해 ‘나’를 찾아가는 이야기. 두 소녀의 시점이 번갈아 가며 서술되는 병렬식 구성을 통해 인물들의 심리를 세세하게 살펴볼 수 있다.
레몬이 가득한 책장,조 코터릴,라임,2016,216,"문학, 200~300쪽, 소설",엄마가 죽은 뒤 세상과 단절된 채 책 속에 빠져 살던 부녀가 곪아 버린 마음의 상처를 치유하고 다시 '세상의 일부'가 되기 위해 용기를 내는 과정을 그리고 있다.
로버트 라이시의 1대 99를 넘어,로버트 라이시,김영사,2015,204,"인문사회, 200~300쪽, 교양",낙수효과와 같이 널리 알려졌지만 틀린 경제 상식을 세계적인 경제학자가 싹 바로잡아주는 책.
로봇 시대 인간의 일,구본권,어크로,2020,392,"과학, 300쪽 이상, 교양","놀라운 속도로 로봇과 인공 지능이 발전하고 있는 시대, 인간은 더 행복해질까. 예술성과 창의성은 인간만의 고유한 능력일까. 과학 기술 시대에 대한 열두 가지 질문이 담긴 책. 두꺼운 책이지만 문장이 쉽고 다양한 사례가 제시돼 학생들이 잘 읽음."
로봇-로숨의 유니버설 로봇,카렐 차페크,모비딕,2015,216,"과학, 200~300쪽, 교양","로봇`이란 단어는 언제가 시작일까? 1920년대 체코의 작가가 이 단어를 처음 썼다는 걸 알게 된다면, 그 이유만으로도 이 책을 읽을 이유는 충분하다. 100년 전, 안드로이드형 로봇의 출발, 과도기, 미래까지 예언하고 있는 듯한 작품이다. (100주년 기념 작품이 이음 출판사에서도 새로 나왔으니 참고.)"
